show_id,type,title,director,cast,country,date_added,release_year,rating,duration,listed_in,description
s5200,Movie,Pup Star: Better 2Gether,Robert Vince,"Kaitlyn Maher, Obba Babatundé, Lombardo Boyar, Molly Burnett, Chris Coppola, Reggie De Leon, David DeLuise, Matty Finochio, Josh Flitter, Benjamin Flores Jr.",Canada,"October 28, 2017",2017,PG,93 min,"Children & Family Movies, Comedies",Returning Pup Star champ Tiny has her Yorkie paws full after an evil rival replaces her with street dog Scrappy during the national competition.
s5390,Movie,A 2nd Chance,Clay Glen,"Nina Pearce, Adam Tuominen, Emily Morris, Amy Handley, Carmel Johnson, Alanah Gilbert, Hapi Murphy, Lilly Blacker, Julie Kay Lumasag, Elysia Markou",Australia,"July 1, 2017",2011,PG,95 min,"Children & Family Movies, Dramas, Sports Movies","A gymnast lacks the confidence she needs to reach the top. But with the help of her new coach, she has the chance to win a spot on the national team."
s5571,Movie,Howards End,James Ivory,"Anthony Hopkins, Vanessa Redgrave, Helena Bonham Carter, Emma Thompson, James Wilby, Samuel West, Jemma Redgrave, Joseph Bennett, Nicola Duffett, Susie Lindeman","United Kingdom, Japan, United States","March 16, 2017",1992,PG,143 min,"Classic Movies, Dramas, Independent Movies","When a husband, acting in his family's ""best interest,"" does not accept his wife's deathbed wish, providence dictates that he pay for his duplicity."
s5646,Movie,Marvel's Hulk: Where Monsters Dwell,Mitch Schauer,"Fred Tatasciore, Liam O'Brien, Jesse Burch, Edward Bosco, Chiara Zanni, Mike Vaughn, Jon Olson, Matthew Waterson, Zach Callison, Laura Bailey, Hope Levy",United States,"January 4, 2017",2016,PG,75 min,"Children & Family Movies, Sci-Fi & Fantasy","On Halloween, the Hulk and Dr. Strange battle monsters wreaking havoc on New York and uncover an evil plot by Nightmare, ruler of the Dream Dimension."
s5649,Movie,Bee Movie,"Steve Hickner, Simon J. Smith","Jerry Seinfeld, Renée Zellweger, Matthew Broderick, Patrick Warburton, John Goodman, Chris Rock, Kathy Bates, Barry Levinson, Larry King, Ray Liotta",United States,"January 1, 2017",2007,PG,92 min,"Children & Family Movies, Comedies","Barry, a worker bee stuck in a dead-end job making honey, sues humans when he learns they've been stealing bees' nectar all along."
s5866,Movie,Marvel Super Hero Adventures: Frost Fight!,Mitch Schauer,"Mick Wingert, Matthew Mercer, Travis Willingham, Fred Tatasciore, Grey DeLisle, Troy Baker, Antony Del Rio, Trevor Devall, Kevin Michael Richardson, Steve Blum, Jane Singer",United States,"February 24, 2016",2015,PG,74 min,"Children & Family Movies, Sci-Fi & Fantasy","In this Christmas-themed special, Captain America and the Avengers battle Loki and Ymir, who plot to steal Santa Claus' powers and conquer the world."
s5938,Movie,The Short Game,Josh Greenbaum,"Sky Sudberry, Allan Kournikova, Jed Dy, Zamokuhle Nxasana, Alexa Pano, Amari Avery, Augustin Valery, Kuang Yang, Jack Nicklaus, Gary Player",United States,"December 12, 2013",2013,PG,100 min,"Children & Family Movies, Documentaries, Sports Movies","They are fiercely competitive athletes, determined to become champions on one of the world's toughest golf courses. And they're still in grade school."
s5942,Movie,Being Elmo: A Puppeteer's Journey,Constance Marks,"Kevin Clash, Whoopi Goldberg",United States,"February 21, 2012",2011,PG,76 min,Documentaries,"Whoopi Goldberg narrates Elmo creator Kevin Clash's remarkable journey from a working-class Baltimore neighborhood to Jim Henson's ""Sesame Street."""
s6030,Movie,A Boy Called Po,John Asher,"Christopher Gorham, Julian Feder, Kaitlin Doubleday, Andrew Bowen, Caitlin Carmichael, Sean Gunn, Bryan Batt, Fay Masterson, Brian George",United States,"January 15, 2018",2016,PG,94 min,"Dramas, Sci-Fi & Fantasy","After his wife's death, an overworked engineer struggles to care for his son with autism, who regresses into a fantasy world to escape real-life bullying."
s6031,Movie,A Bridge Too Far,Richard Attenborough,"Dirk Bogarde, James Caan, Michael Caine, Sean Connery, Edward Fox, Elliott Gould, Gene Hackman, Anthony Hopkins, Hardy Krüger, Laurence Olivier, Ryan O'Neal, Robert Redford, Maximilian Schell, Liv Ullmann","United States, United Kingdom","July 1, 2020",1977,PG,176 min,"Action & Adventure, Classic Movies, Dramas",This wartime drama details a pivotal day in 1944 when an Allied task force tried to win World War II by seizing control of key bridges in Holland.
s6063,Movie,A Walk to Remember,Adam Shankman,"Mandy Moore, Shane West, Peter Coyote, Daryl Hannah, Lauren German, Clayne Crawford, Al Thompson",United States,"July 1, 2020",2002,PG,102 min,"Dramas, Romantic Movies","When bad boy Landon is cast opposite campus bookworm Jamie in a high school play, romance blooms — until tragedy threatens to tear them apart."
s6066,Movie,A Wrinkle in Time,Ava DuVernay,"Storm Reid, Oprah Winfrey, Reese Witherspoon, Mindy Kaling, Deric McCabe, Levi Miller, Chris Pine, Gugu Mbatha-Raw, Zach Galifianakis, Michael Peña, Bellamy Young, André Holland, Will McCormack, Rowan Blanchard, Daniel MacPherson",United States,"September 25, 2018",2018,PG,110 min,Children & Family Movies,"Years after their father disappears, Meg and her younger brother Charles Wallace cross galaxies on a quest to save him from the heart of darkness."
s6070,Movie,A.X.L.,Oliver Daly,"Alex Neustaedter, Becky G., Alex MacNicoll, Dominic Rains, Thomas Jane, Lou Taylor Pucci, Patricia De Leon, Niko Guardado, Ted McGinley, Marie-Françoise Theodore, Eric Etebari, Dorian Kingi",United States,"March 20, 2019",2018,PG,99 min,"Action & Adventure, Children & Family Movies, Independent Movies","Young motocross racer Miles Hill helps a top-secret robotic combat dog evade its ruthless creator and the military, who are in hot pursuit."
s6112,Movie,Alice Doesn't Live Here Anymore,Martin Scorsese,"Ellen Burstyn, Kris Kristofferson, Billy Green Bush, Diane Ladd, Harvey Keitel, Lelia Goldoni, Lane Bradbury, Vic Tayback, Jodie Foster, Alfred Lutter",United States,"July 1, 2019",1974,PG,112 min,"Classic Movies, Comedies, Dramas","A widowed singer and single mother starts over as a diner waitress in Arizona, befriending her coworkers and romancing a ruggedly handsome rancher."
s6114,Movie,Aliens Ate My Homework,Sean McNamara,"William Shatner, Dan Payne, Kirsten Robek, Ty Consiglio, Sean McNamara, Christian Convery, Jayden Greig, Lauren McNamara, Alex Zahara, Sandy Robson",United States,"March 6, 2018",2018,PG,90 min,"Children & Family Movies, Comedies, Sci-Fi & Fantasy",Tiny alien lawmen fly into Rod's bedroom and recruit him into helping them stop an intergalactic criminal – who's disguised as a very familiar human.
s6182,Movie,April and the Extraordinary World,"Christian Desmares, Franck Ekinci","Angela Galuppo, Paul Giamatti, Susan Sarandon, Tony Hale, J.K. Simmons, Tony Robinow, Mark Camacho, Tod Fennell, Carlos Alazraqui, Kari Wahlgren","France, Canada, Belgium","October 1, 2017",2015,PG,107 min,"Action & Adventure, Comedies, International Movies","After the world's top scientists disappear, orphaned April secretly forges ahead with a family experiment and gets tangled up in a vast conspiracy."
s6187,Movie,Arthur Christmas,Sarah Smith,"James McAvoy, Hugh Laurie, Bill Nighy, Jim Broadbent, Imelda Staunton, Ashley Jensen, Ramona Marquez, Marc Wootton, Laura Linney, Eva Longoria, Michael Palin, Joan Cusack, Deborah Findlay, Rich Fulcher, Sarah Smith, Clint Dyer, Kerry Shale, Stewart Lee, Bronagh Gallagher, Kevin Cecil, Alistair McGowan, David Menkin, Kris Pearn, Ian Ashpitel, Rich Hall, Seeta Indrani, Jane Horrocks, Peter Baynham, Emma Kennedy, Dominic West, Jerry Lambert, Julia Davis, Robbie Coltrane, Iain McKee, Sanjeev Bhaskar, Andy Serkis, Tamsin Greig, Rhys Darby, Seamus Malone, Cody Cameron, David Schneider, Kevin Eldon, Danny John-Jules, Brian Cummings","United Kingdom, United States","January 1, 2020",2011,PG,98 min,"Children & Family Movies, Comedies","At Santa Claus's super-secret toy-making facility, Mr. Claus entrusts his son, Arthur, to carry out an ultra-important Christmas mission."
s6258,Movie,Be Somebody,Joshua Caldwell,"Matthew Espinosa, Sarah Jeffery, Allison Paige, Tava Smiley, Caitlin Keats, LaMonica Garrett, Mahaley Patel, Mason McCulley, Liana Ramirez",United States,"November 20, 2019",2016,PG,88 min,"Comedies, Dramas, Romantic Movies","To escape the stress of fame, teen pop star Jordan goes incognito in a small town, where he forms a special bond with high school art student Emily."
s6272,Movie,Bedtime Stories,Adam Shankman,"Adam Sandler, Keri Russell, Guy Pearce, Russell Brand, Richard Griffiths, Jonathan Pryce, Courteney Cox, Lucy Lawless, Teresa Palmer, Aisha Tyler, Laura Ann Kesling, Jackie Sandler, Lorna Scott, Dana Min Goodman, Andrew Collins, Jonathan Loughran, Jonathan Morgan Heit, Nick Swardson, Tim Herlihy, Billy Tyler, Johntae Lipscomb, Mikey Post, Sebastian Saraceno, Bill Romanowski, Sadie Sandler, Carmen Electra, Allen Covert, Kathryn Joosten, Annalise Basso, Blake Clark, Julia Lea Wolov, Sarah G. Buxton",United States,"March 5, 2019",2008,PG,100 min,"Children & Family Movies, Comedies",Skeeter's life is turned upside down when the fantastical stories he makes up to entertain his niece and nephew inexplicably turn into reality.
s6273,Movie,Before the Flood,Fisher Stevens,Leonardo DiCaprio,United States,"February 1, 2018",2016,PG,97 min,Documentaries,Leonardo DiCaprio crisscrosses the globe to investigate the consequences of man-made globe warming and the measures being taken to reverse it.
s6284,Movie,Benji: Off the Leash,Joe Camp,"Nick Whitaker, Chris Kendrick, Randall Newsome, Duane Stephens, Lincoln Hoppe, Christy Summerhays, Scott Wilkinson",United States,"March 6, 2018",2004,PG,100 min,"Children & Family Movies, Dramas","Benji is back in this charming story that's told from the pooch's point of view, tracking his early days as a pup to his current life in showbiz."
s6306,Movie,Big Fat Liar,Shawn Levy,"Frankie Muniz, Paul Giamatti, Amanda Bynes, Amanda Detmer, Donald Faison, Sandra Oh, Russell Hornsby, Michael Bryan French, Christine Tucci, Lee Majors, John Cho","United States, Germany","January 15, 2020",2002,PG,88 min,"Children & Family Movies, Comedies",Junior high students Jason and Kaylee take action when a greedy Hollywood producer turns Jason's essay into a hit film without giving him credit.
s6309,Movie,Bigger Fatter Liar,Ron Oliver,"Ricky Garcia, Jodelle Ferland, Barry Bostwick, Fiona Vroom, Kevin O'Grady, Karen Holness",United States,"April 18, 2017",2017,PG,95 min,"Children & Family Movies, Comedies","When his video game concept is stolen by a dishonest executive, a teenage chronic liar sets out to prove that he's telling the truth, for once."
s6334,Movie,Blinky Bill: The Movie,Deane Taylor,"Ryan Kwanten, Rufus Sewell, Toni Collette, Robin McLeavy, David Wenham, Barry Humphries, Richard Roxburgh, Deborah Mailman, Barry Otto","Australia, United States","February 8, 2017",2015,PG,91 min,Children & Family Movies,Happy koala Blinky Bill and some spunky pals travel the Outback following clues to help him find his long-lost father and finally bring him home.
s6355,Movie,Bolt,"Byron Howard, Chris Williams","John Travolta, Miley Cyrus, Susie Essman, Mark Walton, Malcolm McDowell, James Lipton, Greg Germann, Diedrich Bader, Nick Swardson, J.P. Manoux, Dan Fogelman, Kari Wahlgren, Chloë Grace Moretz, Randy Savage, Ronn Moss, John DiMaggio, Daran Norris, Jeff Bennett, Brian Stepanek, Todd Cummings",United States,"July 22, 2018",2008,PG,99 min,"Children & Family Movies, Comedies","This tale follows German shepherd Bolt, a canine actor who makes a cross-country trek when he's mistakenly shipped from Hollywood to New York City."
s6367,Movie,Boy and the World,Alê Abreu,"Vinícius Garcia, Felipe Zilse, Alê Abreu, Lu Horta, Marco Aurélio Campos, Cassius Romero, Alfredo Rollo",Brazil,"October 1, 2017",2013,PG,80 min,Children & Family Movies,"Young Cuca leaves his idyllic village on a grand adventure to find his father, who has traveled to the city seeking work."
s6371,Movie,Bratz: The Movie,Sean McNamara,"Logan Browning, Janel Parrish, Nathalia Ramos, Skyler Shaye, Chelsea Kane",United States,"June 29, 2020",2007,PG,102 min,"Children & Family Movies, Comedies","When high school hierarchy divides four best friends into different cliques, the girls defy expectations and try to bring their groups together."
s6434,Movie,Cats & Dogs: The Revenge of Kitty Galore,Brad Peyton,"James Marsden, Nick Nolte, Christina Applegate, Katt Williams, Bette Midler, Neil Patrick Harris, Sean Hayes, Wallace Shawn, Roger Moore, Joe Pantoliano, Michael Clarke Duncan, Chris O'Donnell, Jack McBrayer, Kiernan Shipka","United States, Australia","February 1, 2019",2010,PG,82 min,"Children & Family Movies, Comedies",Cats and dogs must set aside their differences and merge animal instincts when Kitty Galore decides to claw her way to global domination.
s6444,Movie,Change in the Air,Dianne Dreyer,"Mary Beth Hurt, Rachel Brosnahan, Aidan Quinn, Olympia Dukakis, M. Emmet Walsh, Peter Gerety, Macy Gray, Satya Bhabha",United States,"March 1, 2020",2018,PG,95 min,Dramas,"When a secretive woman breezes into a quiet town, her subdued neighbors get swept up in curiosity over her ethereal presence."
s6447,Movie,Charlie and the Chocolate Factory,Tim Burton,"Johnny Depp, Freddie Highmore, David Kelly, Helena Bonham Carter, Noah Taylor, Missi Pyle, James Fox, Deep Roy, Christopher Lee, Adam Godley, AnnaSophia Robb, Julia Winter, Jordan Fry, Philip Wiegratz","United Kingdom, United States","January 1, 2020",2005,PG,115 min,"Children & Family Movies, Comedies",The eccentric Willy Wonka opens the doors of his candy factory to five lucky kids who learn the secrets behind his amazing confections.
s6477,Movie,Christian Mingle,Corbin Bernsen,"Lacey Chabert, Jonathan Patrick Moore, Saidah Arrika Ekulona, Stephen Tobolowsky, John O'Hurley, David Keith, Morgan Fairchild, Corbin Bernsen",United States,"June 6, 2019",2014,PG,99 min,"Comedies, Faith & Spirituality, Romantic Movies",A career woman who has everything but romance finds her values challenged when she starts dating a good man she met on a Christian matchmaking site.
s6481,Movie,Christmas with the Kranks,Joe Roth,"Tim Allen, Jamie Lee Curtis, Dan Aykroyd, Erik Per Sullivan, Cheech Marin, Jake Busey, M. Emmet Walsh, Kevin Chamberlin, Elizabeth Franz, René Lavan",United States,"January 1, 2019",2004,PG,99 min,"Children & Family Movies, Comedies",When Luther Krank and his wife opt to skip Christmas – no tree and no rooftop Frosty – can they handle the fallout from their family and neighbors?
s6482,Movie,Christopher Robin,Marc Forster,"Ewan McGregor, Hayley Atwell, Bronte Carmichael, Mark Gatiss, Jim Cummings, Brad Garrett, Nick Mohammed, Peter Capaldi",United States,"March 5, 2019",2018,PG,104 min,"Children & Family Movies, Comedies, Dramas","Now a careworn middle-aged man, Christopher Robin goes on a familiar adventure when his old pal Winnie the Pooh brings him to the Hundred Acre Wood."
s6497,Movie,Cleopatra Jones,Jack Starrett,"Tamara Dobson, Bernie Casey, BrendaSykes, Esther Rolle, Shelley Winters",United States,"November 1, 2019",1973,PG,89 min,"Action & Adventure, Classic Movies","A stylin' special agent chases down drug lords and does her part to stop trafficking. Soon, she finds herself seeking revenge on a dealer."
s6535,Movie,Cop and a Half: New Recruit,Jon Rosenbaum,"Lou Diamond Phillips, Lulu Wilson, Giles Panton, Janet Kidder, Michael Coleman, Wallace Shawn, Gina Holden, Jordyn Ashley Olson, Vincent Tong, Reese Alexander",Canada,"August 17, 2017",2017,PG,96 min,"Children & Family Movies, Comedies",A world-weary detective is forced to team up with a 12-year-old who thinks she's a cop in order to solve a case that's baffled police.
s6537,Movie,Coraline,Henry Selick,"Dakota Fanning, Teri Hatcher, John Hodgman, Jennifer Saunders, Dawn French, Keith David, Robert Bailey Jr., Ian McShane",United States,"March 16, 2017",2009,PG,101 min,Children & Family Movies,Curious young Coraline unlocks a door in her family's home and is transported to a universe that strangely resembles her own – only better.
s6549,Movie,Dad,Gary David Goldberg,"Jack Lemmon, Ted Danson, Olympia Dukakis, Kathy Baker, Kevin Spacey, Ethan Hawke, Zakes Mokae, J.T. Walsh, Peter Michael Goetz, John Apicella, Richard McGonagle, Bill Morey, Mary Fogarty",United States,"April 1, 2018",1989,PG,117 min,Dramas,"Family bonds are revived after a father is diagnosed with cancer in this bittersweet drama. Dutiful son John cares for his aging father, Jake, but not without complaint."
s6551,Movie,Daddy Day Care,Steve Carr,"Eddie Murphy, Jeff Garlin, Steve Zahn, Regina King, Anjelica Huston, Kevin Nealon, Jonathan Katz, Siobhan Fallon Hogan, Lisa Edelstein, Lacey Chabert, Laura Kightlinger, Leila Arcieri",United States,"January 1, 2019",2003,PG,93 min,"Children & Family Movies, Comedies","When a conscientious father loses his lucrative dot-com job and faces economic ruin, he joins two friends in opening a business called Daddy Day Care."
s6623,Movie,Dolphin Tale 2,Charles Martin Smith,"Morgan Freeman, Ashley Judd, Harry Connick Jr., Kris Kristofferson, Nathan Gamble, Austin Stowell, Juliana Harkavy, Charles Martin Smith, Austin Highsmith, Cozi Zuehlsdorff",United States,"February 25, 2019",2014,PG,107 min,"Children & Family Movies, Dramas","Winter the dolphin, who survived a tragic injury by receiving a prosthetic tail, bonds with an orphaned baby dolphin after her beloved pool mate dies."
s6640,Movie,Dr. Seuss' The Cat in the Hat,Bo Welch,"Mike Myers, Alec Baldwin, Kelly Preston, Dakota Fanning, Spencer Breslin, Amy Hill, Sean Hayes, Dan Castellaneta",United States,"May 1, 2019",2003,PG,82 min,"Children & Family Movies, Comedies","While Mom is away, a bored little boy and girl are visited by the Cat in the Hat, who proceeds to turn the house into the ""mother of all messes."""
s6641,Movie,Dr. Seuss' The Grinch,"Scott Mosier, Yarrow Cheney","Benedict Cumberbatch, Cameron Seely, Rashida Jones, Pharrell Williams, Kenan Thompson, Angela Lansbury","France, China, Japan, United States","June 5, 2019",2018,PG,86 min,"Children & Family Movies, Comedies",A grump with a mean streak plots to bring Christmas to a halt in the cheerful town of Whoville. But a generous little girl could change his heart.
s6644,Movie,Dragonheart: A New Beginning,Doug Lefler,"Christopher Masterson, Harry Van Gorkum, Rona Figueroa, Matt Hickey, Henry O, Tom Burke, Robby Benson, Ken Shorter, John Woodnutt, Lubomir Misak",United States,"January 1, 2020",2000,PG,84 min,"Action & Adventure, Sci-Fi & Fantasy","This sequel introduces Draco the dragon's offspring, Drake, who dreams of becoming a knight and teams up with a stable boy to master his skills."
s6658,Movie,Earth to Echo,Dave Green,"Teo Halm, Astro, Reese Hartwig, Ella Wahlestedt, Jason Gray-Stanford, Algee Smith, Cassius Willis, Sonya Leslie, Kerry O'Malley, Virginia Louise Smith, Peter Mackenzie, Valerie Wildman",United States,"October 1, 2019",2014,PG,91 min,"Children & Family Movies, Sci-Fi & Fantasy","When a construction project begins in their neighborhood, four friends start receiving bizarre encoded text messages on their cell phones."
s6662,Movie,East Side Sushi,Anthony Lucero,"Diana Elizabeth Torres, Yutaka Takeuchi, Rodrigo Duarte Clark, Kaya Jade Aguirre, Roji Oyama, Lane Nishikawa, Miyoko Sakatani",United States,"September 15, 2020",2015,PG,106 min,Dramas,"She’s not the usual candidate for the role, but a dogged Mexican-American mother makes it her mission to become a talented sushi chef."
s6711,Movie,Evan Almighty,Tom Shadyac,"Steve Carell, John Goodman, Molly Shannon, Lauren Graham, Graham Phillips, Johnny Simmons, Morgan Freeman, Wanda Sykes, John Michael Higgins, Jonah Hill, Jimmy Bennett",United States,"April 16, 2019",2007,PG,96 min,"Children & Family Movies, Comedies, Faith & Spirituality","God summons narcissistic Evan to build an ark in preparation for a flood. Meanwhile, Evan's family interprets his new hobby as a midlife crisis."
s6776,Movie,Footprints: The Path of Your Life,Juan Manuel Cotelo,,Spain,"June 30, 2017",2015,PG,90 min,"Documentaries, Faith & Spirituality, International Movies","This documentary follows 10 men who agree to walk the Camino de Santiago, a 500-mile, 40-day trek that will challenge their strength and faith."
s6790,Movie,Forks Over Knives,Lee Fulkerson,,United States,"October 3, 2019",2011,PG,96 min,Documentaries,"According to the research of two food scientists, the popularity of processed foods has led to epidemic rates of obesity, diabetes and other diseases."
s6798,Movie,Fred Claus,David Dobkin,"Vince Vaughn, Paul Giamatti, John Michael Higgins, Miranda Richardson, Rachel Weisz, Kathy Bates, Trevor Peacock, Ludacris, Elizabeth Banks",United States,"January 1, 2021",2007,PG,115 min,"Children & Family Movies, Comedies",The holiday season is ruined for Santa Claus when his cranky older brother – a repo man with a sizable rap sheet – visits him at the North Pole.
s6799,Movie,Free Willy,Simon Wincer,"Jason James Richter, Lori Petty, Jayne Atkinson, August Schellenberg, Michael Madsen, Michael Ironside, Richard Riehle, Mykelti Williamson, Michael Bacall, Danielle Harris","United States, France, Mexico","January 1, 2020",1993,PG,112 min,"Children & Family Movies, Dramas","Ordered to clean up the graffiti he painted at a marine theme park, a troubled young boy unexpectedly bonds with a killer whale on exhibit."
s6810,Movie,Froning: The Fittest Man in History,Heber Cannon,Rich Froning,United States,"July 15, 2018",2016,PG,99 min,"Documentaries, International Movies, Sports Movies",Follow the grueling training regimen of Rich Froning Jr. as he sets his sights on winning an unprecedented fourth CrossFit Games title.
s6819,Movie,G-Force,Hoyt Yeatman,"Bill Nighy, Will Arnett, Zach Galifianakis, Kelli Garner, Tyler Patrick Jones, Piper Mackenzie Harris, Gabriel Casseus, Jack Conley, Niecy Nash, Justin Mentell, Nicolas Cage, Sam Rockwell, Jon Favreau, Penélope Cruz, Steve Buscemi, Tracy Morgan",United States,"March 15, 2019",2009,PG,88 min,"Children & Family Movies, Comedies","When a billionaire sets out to take over the world, only one special forces unit can handle the job – a squad of highly trained guinea pigs."
s6838,Movie,George of the Jungle 2,David Grossman,"Christopher Showerman, Julie Benz, Angus T. Jones, Thomas Haden Church, Christina Pickles, John Cleese, Michael Clarke Duncan, John Kassir, Kevin Greutert, Keith Scott","United States, Australia","December 20, 2016",2003,PG,87 min,"Children & Family Movies, Comedies","Now married and raising a son, clumsy ape-man George finds his jungle kingdom in peril as Really Mean Lion challenges him for the throne."
s6841,Movie,Get Santa,Christopher Smith,"Jodie Whittaker, Warwick Davis, Jim Broadbent, Stephen Graham, Nonso Anozie, Rafe Spall, Ewen Bremner, Matt King","United Kingdom, United States","December 12, 2014",2014,PG,103 min,"Children & Family Movies, Comedies","When Santa gets arrested for trespassing after crashing his sleigh, it's up to a father-son team to spring him from jail and save Christmas."
s6859,Movie,God Bless the Broken Road,Harold Cronk,"Patrika Darbo, Kim Delaney, Jordin Sparks, Makenzie Moss, Liam Matthews, Andrew W. Walker, Lindsay Pulsipher, Gary Grubbs, Robin Givens, Arthur Cartwright",United States,"February 9, 2019",2018,PG,111 min,"Children & Family Movies, Dramas, Faith & Spirituality","After a young mother is widowed by war, her faith is tested as she struggles to stay afloat financially and raise her daughter."
s6862,Movie,God's Not Dead,Harold Cronk,"Kevin Sorbo, Shane Harper, David A.R. White, Dean Cain, Benjamin A. Onyango, Paul Kwo, Hadeel Sittu, Trisha LaFache, Cory Oliver, Willie Robertson, Korie Robertson",United States,"April 1, 2020",2014,PG,113 min,"Dramas, Faith & Spirituality",A spiritual college student clashes with an atheistic professor who insists that students will only pass his class by admitting that God is dead.
s6863,Movie,God's Not Dead: A Light in Darkness,Michael Mason,"David A.R. White, John Corbett, Shane Harper, Ted McGinley, Jennifer Taylor, Benjamin A. Onyango, Tatum O'Neal, Cissy Houston",United States,"December 4, 2018",2018,PG,106 min,"Dramas, Faith & Spirituality","After a fire breaks out at his church, a pastor faces a legal battle against university leaders who wish to push the congregation off the campus."
s6879,Movie,"Good Night, and Good Luck",George Clooney,"David Strathairn, Patricia Clarkson, George Clooney, Jeff Daniels, Robert Downey Jr., Frank Langella, Ray Wise, Robert John Burke, Tate Donovan, Alex Borstein, Matt Ross, Grant Heslov","United States, France, United Kingdom, Japan","June 2, 2019",2005,PG,93 min,Dramas,Veteran television newsman Edward R. Murrow faces off against Sen. Joseph McCarthy and his crusade to quell the threat of communism in America.
s6884,Movie,Goosebumps 2: Haunted Halloween,Ari Sandel,"Jeremy Ray Taylor, Madison Iseman, Caleel Harris, Wendi McLendon-Covey, Chris Parnell, Ken Jeong, Jack Black","United States, United Kingdom","April 25, 2019",2018,PG,90 min,"Children & Family Movies, Comedies","Three teens spend their Halloween trying to stop a magical book, which brings characters from the ""Goosebumps"" novels to life."
s6894,Movie,Grease,Randal Kleiser,"John Travolta, Olivia Newton-John, Stockard Channing, Jeff Conaway, Barry Pearl, Michael Tucci, Kelly Ward, Didi Conn, Jamie Donnelly, Dinah Manoff, Eve Arden, Dody Goodman, Sid Caesar, Joan Blondell, Frankie Avalon",United States,"November 1, 2019",1978,PG,110 min,"Classic Movies, Comedies, Music & Musicals",John Travolta and Olivia Newton-John star in this hit musical comedy about a greaser and the good girl he falls for – much to his friends' chagrin.
