show_id,type,title,director,cast,country,date_added,release_year,rating,duration,listed_in,description
s108,Movie,A Champion Heart,David de Vos,"Mandy Grace, David de Vos, Donna Rusch, Devan Key, Isabella Mancuso, Ariana Guido",United States,"September 4, 2021",2018,G,90 min,"Children & Family Movies, Dramas","When a grieving teen must work off her debt to a ranch, she cares for a wounded horse that teaches her more about healing than she expected."
s934,Movie,Hachi: A Dog's Tale,Lasse Hallström,"Richard Gere, Joan Allen, Cary-Hiroyuki Tagawa, Sarah Roemer, Jason Alexander, Erick Avari, Davenia McFadden, Robbie Sublett, Kevin DeCoste, Rob Degnan","United Kingdom, United States","May 1, 2021",2009,G,93 min,"Children & Family Movies, Dramas","When his master dies, a loyal pooch named Hachiko keeps a vigil for more than a decade at the train station where he once greeted his owner every day."
s1127,Movie,My Fair Lady,George Cukor,"Audrey Hepburn, Rex Harrison, Stanley Holloway, Wilfred Hyde-White, Gladys Cooper, Jeremy Brett, Theodore Bikel, Mona Washbourne, Isobel Elsom, John Holland, Alan Napier, Marni Nixon",United States,"April 1, 2021",1964,G,173 min,"Classic Movies, Music & Musicals","When a Cockney flower girl takes elocution lessons from an aloof professor, he decides to introduce her to high society, transforming both their lives."
s1558,Movie,Canvas,Frank E. Abney III,,United States,"December 11, 2020",2020,G,9 min,"Children & Family Movies, Dramas","After a heartbreaking loss, a grandfather struggling to reclaim his passion for painting finds the inspiration to create again."
s2912,Movie,A Shaun the Sheep Movie: Farmageddon,"Richard Phelan, Will Becher","Justin Fletcher, John Sparkes, Amalia Vitale, Kate Harbour, David Holt","United Kingdom, France, Belgium, Ireland, United States","February 14, 2020",2019,G,87 min,"Children & Family Movies, Comedies",Shaun and the flock race to help an adorable alien find her way home after her ship crash-lands near Mossy Bottom Farm and sparks a UFO frenzy.
s3060,Movie,Garfield's Pet Force,Mark A.Z. Dippé,"Frank Welker, Vanessa Marshall, Gregg Berger, Wally Wingert, Audrey Wasilewski, Jason Marsden, Fred Tatasciore, Stephen Stanton, Jennifer Darling, Neil Ross, Greg Eagles, Cathy Cavadini, David Michie, Greg Finley","South Korea, United States","January 1, 2020",2009,G,78 min,"Children & Family Movies, Comedies","When an alien menace and her army of undead minions threaten to enslave the world, Garfield heads a team of comic-strip superheroes to save the day."
s3063,Movie,Jimmy Neutron: Boy Genius,John A. Davis,"Debi Derryberry, Jeffrey Garcia, Rob Paulsen, Megan Cavanagh, Mark DeCarlo, Carolyn Lawrence, Andrea Martin, Candi Milo, Crystal Scales, Martin Short, Patrick Stewart, Jim Cummings","United States, Spain","January 1, 2020",2001,G,83 min,"Children & Family Movies, Comedies, Sci-Fi & Fantasy","When gooey green aliens kidnap all the adults in Retroville, it's up to 11-year-old Jimmy Neutron to come up with a plan to rescue them."
s3473,Movie,Rugrats in Paris: The Movie,"Stig Bergqvist, Paul Demeyer","Elizabeth Daily, Tara Strong, Cheryl Chase, Christine Cavanaugh, Cree Summer, Kath Soucie, Michael Bell, Tress MacNeille, Casey Kasem, Joe Alaskey, Debbie Reynolds, Jack Riley, Susan Sarandon, John Lithgow","Germany, United States","October 1, 2019",2000,G,79 min,"Children & Family Movies, Comedies",The Rugrats take to the big screen and visit Paris when Mr. Pickles gets summoned to fix a giant robot at the EuroReptarland theme park.
s3476,Movie,The Rugrats Movie,"Igor Kovalyov, Norton Virgien","Elizabeth Daily, Christine Cavanaugh, Kath Soucie, Melanie Chartoff, Phil Proctor, Cree Summer, Cheryl Chase, Tara Strong, Jack Riley, Joe Alaskey, Michael Bell, Tress MacNeille, Busta Rhymes, Whoopi Goldberg, David Spade",United States,"October 1, 2019",1998,G,81 min,"Children & Family Movies, Comedies","When his baby brother Dil is born, Tommy Pickles and his pals decide that he's too much responsibility and try to return him to the hospital."
s3545,Movie,Spookley the Square Pumpkin,Bernie Denk,"Sonja Ball, Craig Francis, Rick Jones, Michel Perron, Holly Gauthier-Frankel, Norman Groulx, Terrence Scammell, Bruce Dinsmore, Jennifer Seguin",United States,"September 1, 2019",2004,G,47 min,Children & Family Movies,"When a storm terrorizes his patch, a pumpkin cast out for his shape must step up to use his smarts to save the day – and to prove himself."
s4379,Movie,The Pixar Story,Leslie Iwerks,Stacy Keach,United States,"November 18, 2018",2007,G,89 min,Documentaries,Go behind the scenes at Pixar Animation Studios with this Emmy-nominated documentary tracing the creation and history of the groundbreaking company.
s4874,Movie,Pup Star: World Tour,Robert Vince,"Jed Ress, Makenzie Moss, Denisse Ojeda, Reggie De Leon, David DeLuise, Kaitlyn Maher, Jorge Diaz, George Newbern, Diedrich Bader, Mackenzie Sol","Canada, Japan, United States","May 5, 2018",2018,G,87 min,"Children & Family Movies, Comedies, Music & Musicals","Talented pooches from around the world compete to be the next Pup Star, but behind-the-scenes schemes threaten to ruin the fun."
s5274,Movie,Ghost of the Mountains,Ben Wallis,Antoine Fuqua,United States,"September 13, 2017",2017,G,78 min,"Children & Family Movies, Documentaries",An international group of filmmakers sets out on a mission to get up close and personal with a family of elusive snow leopards.
s5597,Movie,Growing Up Wild,Keith Scholey,Daveed Diggs,United States,"February 19, 2017",2016,G,78 min,"Children & Family Movies, Documentaries","Five baby animals from different parts of the world grow up learning to survive in the wild, nurtured by the love and guidance of their families."
s5598,Movie,Tini: The New Life of Violetta,Juan Pablo Buscarini,"Martina Stoessel, Jorge Blanco, Adrián Salzedo, Mercedes Lambre, Diego Ramos, Clara Alonso, Sofia Carson, Leonardo Cecchi, Ridder van Kooten, Beatrice Arnera, Georgina Amorós","Spain, Italy, Argentina","February 19, 2017",2016,G,99 min,"Children & Family Movies, Music & Musicals","After completing a world tour, a teen pop star spends the summer at an Italian villa to recover from heartbreak and grow into a mature artist."
s5737,Movie,Pup Star,Robert Vince,"Makenzie Moss, Jed Rees, David DeLuise, Carla Jimenez, Tom Everett Scott, Diedrich Bader, George Newbern, Bonnie Somerville, John Ratzenberger",Canada,"October 29, 2016",2016,G,92 min,"Children & Family Movies, Comedies","After a singing pup with big dreams of stardom gets dognapped and escapes with a friend's help, her journey home is a fun, music-filled adventure."
s6117,Movie,All Dogs Go to Heaven,"Don Bluth, Gary Goldman, Dan Kuenster","Dom DeLuise, Burt Reynolds, Daryl Gilley, Candy Devine, Charles Nelson Reilly, Vic Tayback, Melba Moore, Judith Barsi, Rob Fuller, Earleen Carey, Anna Manahan, Nigel Pegram, Loni Anderson, Ken Page, Godfrey Quigley","Ireland, United Kingdom, United States","June 1, 2020",1989,G,85 min,Children & Family Movies,"When a canine con artist becomes an angel, he sneaks back to Earth and crosses paths with an orphan girl who can speak to animals."
s6152,Movie,An American Tail,Don Bluth,"Erica Yohn, Nehemiah Persoff, Amy Green, Phillip Glasser, Christopher Plummer, John Finnegan, Will Ryan, Hal Smith, Dom DeLuise, Madeline Kahn",United States,"April 1, 2018",1986,G,80 min,Children & Family Movies,"Fievel, a young Russian mouse, immigrates to America and must make his own way in the strange and sometimes perilous new world."
s6153,Movie,An American Tail: Fievel Goes West,"Phil Nibbelink, Simon Wells","Philip Glasser, James Stewart, Erica Yohn, Cathy Cavadini, Nehemiah Persoff, Dom DeLuise, Amy Irving, John Cleese, Jon Lovitz",United States,"April 1, 2018",1991,G,75 min,Children & Family Movies,"Fievel and his family head west for what turns out to be a wild adventure. Deep in cowboy country, the intrepid mouse faces down a nasty feline."
s6154,Movie,An American Tail: The Mystery of the Night Monster,Larry Latham,"Thomas Dekker, Lacey Chabert, Jane Singer, Nehemiah Persoff, Susan Boyd, Robert Hays, Pat Musick, Dom DeLuise, Candi Milo, Jeff Bennett",United States,"April 1, 2018",1999,G,75 min,Children & Family Movies,"When a monster goes on a mouse-napping spree in New York, Fievel and his friends help a reporter get to the bottom of the mystery."
s6155,Movie,An American Tail: The Treasures of Manhattan Island,Larry Latham,"Thomas Dekker, Dom DeLuise, Pat Musick, Nehemiah Persoff, Erica Yohn, Lacey Chabert, Elaine Bilstad, Rene Auberjonois, David Carradine, Sherman Howard, Tony Jay, Richard Karron, John Kassir, Ron Perlman",United States,"April 1, 2018",2000,G,79 min,Children & Family Movies,"When Fievel and friends go hunting for buried treasure beneath the ruins of an old subway tunnel, they stumble onto something surprising."
s6221,Movie,Balto,Simon Wells,"Kevin Bacon, Bob Hoskins, Bridget Fonda, Jim Cummings, Phil Collins, Jack Angel, Danny Mann, Robbie Rist",United States,"April 1, 2018",1995,G,78 min,"Children & Family Movies, Dramas","Balto, who is half wolf and half dog, endures the taunts of disapproving humans as he guides a precious cargo of medicine through the Alaskan winter."
s6222,Movie,Balto 2: Wolf Quest,Phil Weinstein,"Maurice LaMarche, Jodi Benson, Lacey Chabert, David Carradine, Mark Hamill, Charles Fleischer, Peter MacNicol, Rob Paulsen, Nicolette Little, Melanie Stone",United States,"April 1, 2018",2001,G,75 min,Children & Family Movies,"Half-dog, half-wolf Balto (voiced by Maurice LaMarche) and his wife proudly put their pups up for adoption to humans, but when nobody takes daughter Aleu because she looks too much like a wolf, she runs away to search for her place in the world."
s6223,Movie,Balto 3: Wings of Change,Phil Weinstein,"Maurice LaMarche, Sean Astin, Keith Carradine, Charles Fleischer, Jodi Benson, Bill Fagerbakke, Charity James, Kathy Najimy, David Paymer, Jean Smart",United States,"April 1, 2018",2004,G,78 min,Children & Family Movies,"A pilot challenges Balto's son Kodi and his sled team to see who can deliver the mail faster, but the dogs race to the rescue when the plane vanishes."
s6449,Movie,Charlotte's Web,"Charles A. Nichols, Iwao Takamoto","Debbie Reynolds, Charles Nelson Reilly, Paul Lynde, Henry Gibson, Rex Allen, Danny Bonaduce, Pamelyn Ferdin, Don Messick, Agnes Moorehead, Martha Scott, John Stephenson, Herb Vigran, Dave Madden",United States,"November 23, 2019",1973,G,94 min,"Children & Family Movies, Classic Movies","Follow the adventures of Wilbur the pig, Templeton the rat and Charlotte the spider in this animated musical version of E.B. White's timeless story."
s6467,Movie,Chicken Little,Mark Dindal,"Zach Braff, Joan Cusack, Patrick Stewart, Steve Zahn, Catherine O'Hara, Harry Shearer, Adam West, Don Knotts, Amy Sedaris, Garry Marshall, Patrick Warburton, Fred Willard, Wallace Shawn",United States,"March 16, 2016",2005,G,82 min,"Children & Family Movies, Comedies",No one believes Chicken Little when he tries to warn of an alien invasion – so it's up to him and his misfit friends to save the world!
s6474,Movie,Chitty Chitty Bang Bang,Ken Hughes,"Dick Van Dyke, Sally Ann Howes, Lionel Jeffries, Gert Fröbe, Anna Quayle, Benny Hill, James Robertson Justice, Robert Helpmann, Heather Ripley, Adrian Hall, Barbara Windsor, Davy Kaye, Alexander Doré, Bernard Spear, Stanley Unwin","United Kingdom, United States","January 1, 2020",1968,G,146 min,"Children & Family Movies, Classic Movies, Comedies","Quirky inventor Caractacus Potts and his family travel in their magical flying car to Vulgaria, a kingdom strangely devoid of children."
s6747,Movie,Fiddler on the Roof,Norman Jewison,"Topol, Norma Crane, Leonard Frey, Molly Picon, Paul Mann, Rosalind Harris, Michele Marsh, Neva Small, Paul Michael Glaser, Ray Lovelock",United States,"July 1, 2020",1971,G,181 min,"Classic Movies, Dramas, Music & Musicals","This adaptation of the musical chronicles the trials of a Jewish peasant, his wife, and their three strong-willed daughters in pre-revolutionary Russia."
s6782,Movie,For the Love of Benji,Joe Camp,"Patsy Garrett, Cynthia Smith, Allen Fiuzat, Ed Nelson, Art Vasil, Peter Bowles, Bridget Armstrong, Mihalis Lambrinos, Dean Goss, Tony Alatis",United States,"March 6, 2018",1977,G,84 min,Children & Family Movies,"Benji and his owner get separated in Greece. On his quest to find them, he's targeted by various bad guys who want to get their hands on him."
s6785,Movie,Forbidden Planet,Fred M. Wilcox,"Leslie Nielsen, Walter Pidgeon, Anne Francis, Jack Kelly, Warren Stevens, James Drury, Earl Holliman",United States,"November 1, 2019",1956,G,98 min,"Action & Adventure, Classic Movies, Sci-Fi & Fantasy","A pulp-fiction sci-fi classic, Forbidden Planet stars Leslie Nielsen as a heroic starship captain who finds the paradise planet Altair-IV."
s6854,Movie,Gigi,"Vincente Minnelli, Charles Walters","Leslie Caron, Maurice Chevalier, Louis Jourdan, Hermione Gingold, Eva Gabor, Jacques Bergerac, Isabel Jeans, John Abbott, Edwin Jerome, Corinne Marchand",United States,"November 1, 2019",1958,G,115 min,"Classic Movies, Comedies, Music & Musicals",Gigi's an avant-garde French waif being groomed as the fille de joie of affluent and handsome Gaston. Soon Gigi metamorphoses into a stunning beauty.
s7155,Movie,Justin Bieber: Never Say Never,Jon M. Chu,"Justin Bieber, Ludacris, Usher Raymond, Jaden Smith, Miley Cyrus, Sean Kingston, Boyz II Men",United States,"January 1, 2018",2011,G,106 min,"Documentaries, Music & Musicals","Teen idol Justin Bieber provides personal snapshots from throughout his career, culminating with scenes from his triumphant 2010 concert tour."
s7636,Movie,Océans,"Jacques Perrin, Jacques Cluzaud","Pierce Brosnan, Jacques Perrin, Rie Miyazawa, Lancelot Perrin","France, Switzerland, Spain, United States, United Arab Emirates","September 19, 2019",2009,G,84 min,"Documentaries, International Movies",This documentary examines the vital role water plays in human existence and the cause-and-effect interplay between oceans and the environment.
s8152,Movie,Tarzan,"Chris Buck, Kevin Lima","Tony Goldwyn, Minnie Driver, Glenn Close, Brian Blessed, Nigel Hawthorne, Rosie O'Donnell, Lance Henriksen, Wayne Knight, Alex D. Linz",United States,"June 23, 2018",1999,G,89 min,Children & Family Movies,"After being shipwrecked off the African coast, a lone child grows up in the wild, and is destined to become lord of the jungle."
s8153,Movie,Tarzan 2,Brian Smith,"Harrison Chad, George Carlin, Brad Garrett, Ron Perlman, Estelle Harris, Glenn Close, Lance Henriksen, Brenda Grate, Harrison Fahn",United States,"June 23, 2017",2005,G,72 min,Children & Family Movies,How did the King of the Jungle ascend to the throne? Find out in this charming prequel to the hit animated movie that catches Tarzan as a young child.
s8456,Movie,The Pirate Fairy,Peggy Holmes,"Mae Whitman, Christina Hendricks, Tom Hiddleston, Lucy Liu, Raven-Symoné, Megan Hilty, Pamela Adlon, Angela Bartys, Jim Cummings, Carlos Ponce, Mick Wingert, Kevin Michael Richardson, Jeff Bennett, Rob Paulsen, Grey DeLisle, Kari Wahlgren, Jane Horrocks, Jesse McCartney, Anjelica Huston",United States,"June 15, 2014",2014,G,78 min,Children & Family Movies,"In this spritely tale, Tinker Bell and her friends set out to find free-spirited fairy Zarina after she makes off with some precious Blue Pixie Dust."
s8462,Movie,The Polar Express,Robert Zemeckis,"Tom Hanks, Leslie Zemeckis, Eddie Deezen, Nona Gaye, Peter Scolari, Brendan King, Andy Pellick, Michael Jeter, Chris Coppola, Julene Renee",United States,"January 1, 2021",2004,G,100 min,Children & Family Movies,"In this warm-hearted tale, a young boy's faith in the holiday spirit is revived after he makes his way by train to the North Pole on Christmas Eve."
s8467,Movie,The Princess and the Frog,"Ron Clements, John Musker","Anika Noni Rose, Bruno Campos, Keith David, Michael-Leon Wooley, Jennifer Cody, Jim Cummings, Peter Bartlett, Jenifer Lewis, Oprah Winfrey, Terrence Howard, John Goodman, Emeril Lagasse, June Christopher, Paul Briggs, Rob Edwards, John Kassir, Fred Tatasciore, Kimberly Russell, Rif Hutton, Randy Newman, Bridget Hoffman, Corey Burton, Joe Whyte, Michael Colyar, Bruce Smith, Terri Douglas, Claudette Wells, Roger Aaron Brown, Mona Marshall, Terence Blanchard, Kwesi Boakye, Mick Wingert, David Cowgill, Peter Renaday, John Musker, Ritchie Montgomery, Jerry Kernion, Philip Proctor, Eddie Frierson",United States,"July 16, 2019",2009,G,98 min,Children & Family Movies,"In New Orleans during the Jazz Age, a beautiful girl named Tiana has a fateful encounter with frog prince who desperately wants to be human again."
s8595,Movie,Tinker Bell and the Legend of the NeverBeast,Steve Loter,"Ginnifer Goodwin, Mae Whitman, Rosario Dawson, Lucy Liu, Pamela Adlon, Raven-Symoné, Megan Hilty, Kari Wahlgren, Anjelica Huston, Jeff Corwin, Olivia Holt, Thomas Lennon, Chloe Bennet, Danai Gurira, Grey DeLisle, Peter Michael",United States,"May 17, 2015",2014,G,78 min,Children & Family Movies,"When suspicious scout fairies scheme to capture the fearsome-looking NeverBeast, Tinker Bell and Fawn set out to save the wondrous creature."
s8636,Movie,True Grit,Henry Hathaway,"John Wayne, Glen Campbell, Kim Darby, Jeremy Slate, Robert Duvall, Dennis Hopper, Alfred Ryder, Strother Martin, Jeff Corey",United States,"January 1, 2020",1969,G,128 min,"Classic Movies, Dramas",Teenage tomboy Mattie Ross enlists the help of crusty lawman Rooster Cogburn to track down the hired hand who murdered her father.
s8746,Movie,Willy Wonka & the Chocolate Factory,Mel Stuart,"Gene Wilder, Jack Albertson, Peter Ostrum, Roy Kinnear, Julie Dawn Cole, Leonard Stone, Denise Nickerson, Dodo Denney, Paris Themmen, Ursula Reit","United States, East Germany, West Germany","January 1, 2020",1971,G,100 min,"Children & Family Movies, Classic Movies, Comedies",Zany Willy Wonka causes a stir when he announces that golden tickets hidden inside his candy bars will admit holders into his secret confectionary.
