show_id,type,title,director,cast,country,date_added,release_year,rating,duration,listed_in,description
s7,Movie,My Little Pony: A New Generation,"Robert Cullen, José Luis Ucha","Vanessa Hudgens, Kimiko Glenn, James Marsden, Sofia Carson, Liza Koshy, Ken Jeong, Elizabeth Perkins, Jane Krakowski, Michael McKean, Phil LaMarr",,"September 24, 2021",2021,PG,91 min,Children & Family Movies,"Equestria's divided. But a bright-eyed hero believes Earth Ponies, Pegasi and Unicorns should be pals — and, hoof to heart, she’s determined to prove it."
s42,Movie,Jaws,Steven Spielberg,"Roy Scheider, Robert Shaw, Richard Dreyfuss, Lorraine Gary, Murray Hamilton, Carl Gottlieb, Jeffrey Kramer, Susan Backlinie, Jonathan Filley, Ted Grossman",United States,"September 16, 2021",1975,PG,124 min,"Action & Adventure, Classic Movies, Dramas","When an insatiable great white shark terrorizes Amity Island, a police chief, an oceanographer and a grizzled shark hunter seek to destroy the beast."
s43,Movie,Jaws 2,Jeannot Szwarc,"Roy Scheider, Lorraine Gary, Murray Hamilton, Joseph Mascolo, Jeffrey Kramer, Collin Wilcox Paxton, Ann Dusenberry, Mark Gruner, Barry Coe, Susan French",United States,"September 16, 2021",1978,PG,116 min,"Dramas, Horror Movies, Thrillers","Four years after the last deadly shark attacks, police chief Martin Brody fights to protect Amity Island from another killer great white."
s44,Movie,Jaws 3,Joe Alves,"Dennis Quaid, Bess Armstrong, Simon MacCorkindale, Louis Gossett Jr., John Putch, Lea Thompson, P.H. Moriarty, Dan Blasko, Liz Morris, Lisa Maurer",United States,"September 16, 2021",1983,PG,98 min,"Action & Adventure, Horror Movies, Thrillers","After the staff of a marine theme park try to capture a young great white shark, they discover its mother has invaded the enclosure and is out for blood."
s46,Movie,My Heroes Were Cowboys,Tyler Greco,,,"September 16, 2021",2021,PG,23 min,Documentaries,"Robin Wiltshire's painful childhood was rescued by Westerns. Now he lives on the frontier of his dreams, training the horses he loves for the big screen."
s95,Movie,Show Dogs,Raja Gosnell,"Will Arnett, Ludacris, Natasha Lyonne, Stanley Tucci, Jordin Sparks, Gabriel Iglesias, Shaquille O'Neal, Omar Chaparro, Alan Cumming, Andy Beckwith, Delia Sheppard, Kerry Shale","United Kingdom, United States","September 8, 2021",2018,PG,90 min,"Children & Family Movies, Comedies",A rough and tough police dog must go undercover with an FBI agent as a prim and proper pet at a dog show to save a baby panda from an illegal sale.
s116,Movie,Bright Star,Jane Campion,"Abbie Cornish, Ben Whishaw, Paul Schneider, Kerry Fox, Edie Martin, Thomas Brodie-Sangster, Claudie Blakley, Gerard Monaco, Antonia Campbell-Hughes, Samuel Roukin","United Kingdom, Australia, France","September 2, 2021",2009,PG,119 min,"Dramas, Romantic Movies",This drama details the passionate three-year romance between Romantic poet John Keats – who died tragically at age 25 – and his great love and muse.
s128,Movie,A Cinderella Story,Mark Rosman,"Hilary Duff, Chad Michael Murray, Jennifer Coolidge, Dan Byrd, Regina King, Julie Gonzalo, Lin Shaye, Madeline Zima, Andrea Avery, Mary Pat Gleason, Paul Rodriguez, Whip Hubley, Kevin Kilner, Erica Hubbard, Simon Helberg","United States, Canada","September 1, 2021",2004,PG,95 min,"Children & Family Movies, Comedies",Teen Sam meets the boy of her dreams at a dance before returning to toil in her stepmother's diner. Can her lost cell phone bring them together?
s138,Movie,Crocodile Dundee in Los Angeles,Simon Wincer,"Paul Hogan, Linda Kozlowski, Jere Burns, Jonathan Banks, Aida Turturro, Alec Wilson, Gerry Skilton, Steve Rackman, Serge Cockburn, Paul Rodriguez, Mark Adair-Rios, Tiriel Mora, Grant Piro, Mike Tyson","Australia, United States","September 1, 2021",2001,PG,95 min,"Action & Adventure, Comedies","When Mick ""Crocodile"" Dundee and his family land in Los Angeles, they soon learn some lessons about American life in this comedy sequel."
s156,Movie,Labyrinth,Jim Henson,"David Bowie, Jennifer Connelly, Frank Oz, Kevin Clash, Anthony Asbury, Dave Goelz, Brian Henson, Ron Mueck, Karen Prell, Shari Weiser","United Kingdom, United States","September 1, 2021",1986,PG,101 min,"Action & Adventure, Children & Family Movies, Cult Movies","In Jim Henson's fantasy, teen Sarah embarks on a life-altering quest to rescue her little brother from the clutches of a treacherous goblin."
s157,Movie,Letters to Juliet,Gary Winick,"Amanda Seyfried, Christopher Egan, Gael García Bernal, Vanessa Redgrave, Franco Nero, Luisa Ranieri, Marina Massironi, Milena Vukotic, Marcia DeBonis, Luisa De Santis, Lidia Biondi, Giordano Formenti, Chris Egan",United States,"September 1, 2021",2010,PG,105 min,"Comedies, Dramas, Romantic Movies","By responding to a letter addressed to Shakespeare's tragic heroine Juliet Capulet, an American woman in Verona, Italy, is led in search of romance."
s168,Movie,Open Season 2,"Matthew O'Callaghan, Todd Wilderman","Joel McHale, Mike Epps, Jane Krakowski, Billy Connolly, Crispin Glover, Steve Schirripa, Georgia Engel, Diedrich Bader, Cody Cameron, Fred Stoller, Olivia Hack","United States, Canada","September 1, 2021",2008,PG,76 min,"Children & Family Movies, Comedies",Elliot the buck and his forest-dwelling cohorts must rescue their dachshund pal from some spoiled pets bent on returning him to domesticity.
s169,Movie,Osmosis Jones,"Bobby Farrelly, Peter Farrelly","Chris Rock, Laurence Fishburne, David Hyde Pierce, Brandy Norwood, William Shatner, Ron Howard, Kid Rock, Ben Stein",United States,"September 1, 2021",2001,PG,95 min,"Action & Adventure, Children & Family Movies, Comedies",Peter and Bobby Farrelly outdo themselves with this partially animated tale about an out-of-shape 40-year-old man who's the host to various organisms.
s232,Movie,The Water Man,David Oyelowo,"David Oyelowo, Rosario Dawson, Lonnie Chavis, Amiah Miller, Alfred Molina, Maria Bello",United States,"August 25, 2021",2021,PG,92 min,"Children & Family Movies, Dramas","Desperate to save his ailing mother, 11-year-old Gunner runs away from home on a quest to find a mythic figure rumored to have the power to cheat death."
s301,Movie,Vivo,"Kirk DeMicco, Brandon Jeffords","Lin-Manuel Miranda, Ynairaly Simo, Zoe Saldana, Juan de Marcos, Brian Tyree Henry, Gloria Estefan, Michael Rooker, Nicole Byer","Canada, United States","August 6, 2021",2021,PG,100 min,"Children & Family Movies, Music & Musicals",A music-loving kinkajou embarks on the journey of a lifetime to fulfill his destiny and deliver a love song for an old friend.
s326,Movie,Beethoven,Brian Levant,"Charles Grodin, Bonnie Hunt, Dean Jones, Oliver Platt, Stanley Tucci, Nicholle Tom, Christopher Castile, Sarah Rose Karr, David Duchovny, Patricia Heaton, O-Lan Jones, Nancy Fish",United States,"August 1, 2021",1992,PG,87 min,"Children & Family Movies, Comedies","A father reluctantly agrees to let his children keep a St. Bernard puppy, but the playful pooch soon turns into a full-grown engine of destruction."
s327,Movie,Beethoven's 2nd,Rod Daniel,"Charles Grodin, Bonnie Hunt, Nicholle Tom, Christopher Castile, Sarah Rose Karr, Debi Mazar, Chris Penn",United States,"August 1, 2021",1993,PG,88 min,"Children & Family Movies, Comedies","After St. Bernard Beethoven sires a brood with Missy, he and the Newton kids must intervene when Missy's owner tries to sell the puppies."
s331,Movie,Cloudy with a Chance of Meatballs,"Phil Lord, Christopher Miller","Bill Hader, Anna Faris, James Caan, Andy Samberg, Bruce Campbell, Mr. T, Bobb'e J. Thompson, Benjamin Bratt, Neil Patrick Harris, Al Roker","United States, Canada","August 1, 2021",2009,PG,90 min,"Children & Family Movies, Comedies, Sci-Fi & Fantasy","When inventor Flint Lockwood makes clouds rain food, the citizens of Chewandswallow can feed themselves. But a bowl of disaster is about to overflow."
s345,Movie,My Girl 2,Howard Zieff,"Anna Chlumsky, Austin O'Brien, Dan Aykroyd, Jamie Lee Curtis, Richard Masur, Christine Ebersole, Angeline Ball",United States,"August 1, 2021",1994,PG,99 min,"Children & Family Movies, Comedies, Dramas",A teen makes surprising discoveries when she talks to her dead mother's high school friends for an essay about someone she admires but has never met.
s346,Movie,Open Season: Scared Silly,David Feiss,"William Townsend, Donny Lucas, Melissa Sturm, Trevor Devall, Brian Drummond, Kathleen Barr, Garry Chalk, Lee Tockar, Shannon Chan-Kent, Michelle Murdocca, Lorne Cardinal, Peter Kelamis","United States, Canada","August 1, 2021",2015,PG,85 min,"Children & Family Movies, Comedies","When a spooky werewolf tale scares Boog out of joining the annual camping trip, his friends hatch a plan to cure him of his fear."
s348,Movie,Planet 51,Jorge Blanco,"Justin Long, Dwayne Johnson, Gary Oldman, Seann William Scott, Jessica Biel, John Cleese, Freddie Benedict","Spain, United Kingdom, United States","August 1, 2021",2009,PG,91 min,"Children & Family Movies, Comedies, Sci-Fi & Fantasy","After landing on a planet reminiscent of 1950s suburbia, a human astronaut tries to avoid capture, recover his spaceship and make it home safely."
s394,Movie,A Second Chance:  Rivals!,Clay Glen,"Emily Morris, Stella Shute, Eva Grados, India Colombi, Nina Pearce, Adam Tuominen, Carmel Johnson, Natasha Wanganeen, Elysia Markou, Alexander Lloyd, Amy Handley",Australia,"July 23, 2021",2021,PG,91 min,"Children & Family Movies, Sports Movies","Crushed when she doesn't qualify for the Olympics, a now-grown Maddy Cornell finds new purpose coaching young gymnasts going up against a rival team."
s461,Movie,Surf's Up,"Ash Brannon, Chris Buck","Shia LaBeouf, Jeff Bridges, Zooey Deschanel, Jon Heder, James Woods, Diedrich Bader, Mario Cantone, Kelly Slater, Rob Machado, Sal Masekela","United States, Canada","July 15, 2021",2007,PG,86 min,"Children & Family Movies, Comedies, Sports Movies",This Oscar-nominated animated comedy goes behind the scenes at the Penguin World Surfing Championship to get a close-up look at the inventors of surfing.
s487,Movie,Ratchet and Clank,"Jericca Cleland, Kevin Munroe","Paul Giamatti, John Goodman, Bella Thorne, Rosario Dawson, Jim Ward, Armin Shimerman, Vincent Tong, Andrew Cownden, James Arnold Taylor, David Kaye, Sylvester Stallone","Hong Kong, Canada, United States","July 9, 2021",2016,PG,94 min,"Children & Family Movies, Comedies, Sci-Fi & Fantasy",Affable alien Ratchet longs to be a Galactic Ranger and might get the chance when rogue robot Clank tells him of evil Drek's plot to destroy a galaxy.
s569,Movie,Dennis the Menace,Nick Castle,"Walter Matthau, Mason Gamble, Joan Plowright, Christopher Lloyd, Lea Thompson, Robert Stanton, Paul Winfield",United States,"July 1, 2021",1993,PG,96 min,"Children & Family Movies, Comedies","The bane of George's life is a little boy named Dennis. But when a cunning thief attempts to rob George, Dennis may be the only one who can stop him."
s574,Movie,Kung Fu Panda,"John Stevenson, Mark Osborne","Jack Black, Dustin Hoffman, Angelina Jolie, Ian McShane, Seth Rogen, Lucy Liu, Jackie Chan, David Cross, Randall Duk Kim, James Hong","United States, China","July 1, 2021",2008,PG,94 min,"Children & Family Movies, Comedies","When a powerful villain comes after peace in his valley, a lazy panda rises to the challenge to realize his destiny and become a kung fu warrior."
s575,Movie,Kung Fu Panda 2,Jennifer Yuh Nelson,"Jack Black, Angelina Jolie, Dustin Hoffman, Gary Oldman, Seth Rogen, Lucy Liu, Jackie Chan, David Cross, James Hong, Michelle Yeoh","United States, China","July 1, 2021",2011,PG,93 min,"Children & Family Movies, Comedies","With his fists up and belly full, Po embarks on a perilous journey with the Furious Five to take on a frightful new enemy and save the art of kung fu."
s594,Movie,Snow Day,Chris Koch,"Chris Elliott, Mark Webber, Jean Smart, Schuyler Fisk, Iggy Pop, Pam Grier, John Schneider, Chevy Chase, Zena Grey, Josh Peck",United States,"July 1, 2021",2000,PG,89 min,"Children & Family Movies, Comedies","When a snow day shuts down the whole town, the Wheeler family cuts loose. Hal makes a play for the most popular girl in his school, 10-year-old Natalie takes on the dreaded snowplow man, and Dad gets into a showdown with a rival meteorologist."
s596,Movie,Stuart Little,Rob Minkoff,"Michael J. Fox, Jonathan Lipnicki, Geena Davis, Hugh Laurie, Nathan Lane","Germany, United States","July 1, 2021",1999,PG,85 min,"Children & Family Movies, Comedies","When his parents adopt a mouse instead of a little boy, George realizes brothers come in all shapes and sizes. But Snowbell the cat is not so welcoming."
s602,Movie,The Karate Kid,John G. Avildsen,"Ralph Macchio, Pat Morita, Elisabeth Shue, Martin Kove, Randee Heller, William Zabka, Ron Thomas, Rob Garrison",United States,"July 1, 2021",1984,PG,127 min,"Action & Adventure, Children & Family Movies, Classic Movies","When a bullied teen befriends an unassuming martial arts master, he’ll learn life lessons — and the right moves — to beat back his merciless rivals."
s603,Movie,The Karate Kid Part II,John G. Avildsen,"Ralph Macchio, Pat Morita, Nobu McCarthy, Tamlyn Tomita, Yuji Okumoto, Joey Miyashima, Marc Hayashi, Danny Kamekona, Tony O'Dell, Martin Kove, William Zabka",United States,"July 1, 2021",1986,PG,113 min,"Action & Adventure, Children & Family Movies, Dramas","Daniel and his martial-arts mentor, Mr. Miyagi, visit Okinawa where they battle a hostile new nemesis and a former foe looking to settle an old score."
s604,Movie,The Karate Kid Part III,John G. Avildsen,"Ralph Macchio, Pat Morita, Robyn Lively, Thomas Ian Griffith, Martin Kove, Sean Kanan, Jonathan Avildsen, Randee Heller, William Christopher Ford",United States,"July 1, 2021",1989,PG,112 min,"Children & Family Movies, Dramas",A returning adversary threatens the bond between karate champ Daniel and mentor Mr. Miyagi with an intricate plan for revenge and a brutal challenger.
s642,Movie,Sisters on Track,,,,"June 24, 2021",2021,PG,97 min,"Documentaries, Sports Movies",Three track star sisters face obstacles in life and in competition as they pursue Junior Olympic dreams in this extraordinary coming of age journey.
s737,Movie,Skater Girl,Manjari Makijany,"Rachel Saanchita Gupta, Amy Maghera, Shafin Patel, Ambrish Saxena, Swati Das, Jonathan Readwin, Ankit Yadav, Anurag Arora, Vinayak Gupta, Vivek Yadav, Waheeda Rehman","United States, India","June 11, 2021",2021,PG,110 min,"Children & Family Movies, Dramas, International Movies","When a teen in rural India discovers a life-changing passion for skateboarding, she faces a rough road as she follows her dream to compete."
s740,Movie,Wish Dragon,Chris Appelhans,"Jimmy Wong, John Cho, Constance Wu, Will Yun Lee, Bobby Lee, Jimmy O. Yang, Ian Chen","China, United States, Canada","June 11, 2021",2021,PG,102 min,"Children & Family Movies, Comedies",Determined teen Din is longing to reconnect with his childhood best friend when he meets a wish-granting dragon who shows him the magic of possibilities.
s793,Movie,Flipped,Rob Reiner,"Madeline Carroll, Callan McAuliffe, Rebecca De Mornay, Anthony Edwards, John Mahoney, Penelope Ann Miller, Aidan Quinn, Kevin Weisman, Morgan Lily, Ryan Ketzner",United States,"June 2, 2021",2010,PG,90 min,"Comedies, Dramas, Romantic Movies","Bryce and Juli first meet as children, with Juli having a crush on Bryce. As they mature, it appears their bond may blossom into something more."
s811,Movie,Streets of Fire,Walter Hill,"Michael Paré, Diane Lane, Rick Moranis, Amy Madigan, Willem Dafoe, Deborah Van Valkenburgh, Richard Lawson, Rick Rossovich, Bill Paxton, Lee Ving",United States,"June 2, 2021",1984,PG,94 min,"Action & Adventure, Classic Movies, Cult Movies","Tough ex-soldier Tom Cody springs into action when a depraved motorcycle gang kidnaps his former girlfriend, Ellen, who's now a famous singer."
s815,Movie,The Four Seasons,Alan Alda,"Alan Alda, Carol Burnett, Len Cariou, Sandy Dennis, Rita Moreno, Jack Weston, Bess Armstrong, Elizabeth Alda, Beatrice Alda",United States,"June 2, 2021",1981,PG,108 min,"Comedies, Romantic Movies","Three middle-aged couples vacation together every season until one of the men ditches his wife for a younger woman, tilting the group's dynamics."
s820,Movie,The Outlaw Josey Wales,Clint Eastwood,"Clint Eastwood, Sondra Locke, Chief Dan George, Bill McKinney, John Vernon, Paula Trueman, Sam Bottoms, Geraldine Keams, Woodrow Parfrey, Joyce Jameson",United States,"June 2, 2021",1976,PG,136 min,"Action & Adventure, Classic Movies","In this gritty Oscar-nominated Western, an ex-Confederate soldier on the run comes to rest in a quiet community, where he falls for a pretty settler."
s847,Movie,Home,Tim Johnson,"Jim Parsons, Rihanna, Steve Martin, Jennifer Lopez, Matt Jones, Brian Stepanek, April Lawrence",United States,"May 25, 2021",2015,PG,94 min,"Children & Family Movies, Comedies, Sci-Fi & Fantasy","When misfit alien Oh mistakenly sends a party invite to the entire galaxy, he goes on the run to avoid trouble and befriends spunky human girl Tip."
s864,Movie,Spy Kids: All the Time in the World,Robert Rodriguez,"Jessica Alba, Joel McHale, Rowan Blanchard, Mason Cook, Jeremy Piven, Alexa PenaVega, Daryl Sabara, Ricky Gervais, Danny Trejo",United States,"May 20, 2021",2011,PG,88 min,"Children & Family Movies, Comedies",Twins Rebecca and Cecil spring into action with their retired secret agent stepmother to stop a time-manipulating mastermind and his nefarious plans.
s925,Movie,Aliens Stole My Body,Sean McNamara,"Jayden Greig, Lauren McNamara, Dan Payne, Alex Zahara, Sean Quan, Kirsten Robek, Ty Consiglio, Christian Convery, Sandy Robson, Christina Meredith Lewall, George Takei",United States,"May 1, 2021",2020,PG,88 min,"Children & Family Movies, Comedies",The Galactic Patrol is on the hunt for Deputy Rod Allbright's body. Now they must team up with old and new friends to stop the body-snatching fiend.
s936,Movie,Madagascar 3: Europe's Most Wanted,"Eric Darnell, Tom McGrath, Conrad Vernon","Ben Stiller, Chris Rock, David Schwimmer, Jada Pinkett Smith, Sacha Baron Cohen, Cedric the Entertainer, Andy Richter, Tom McGrath, Frances McDormand, Jessica Chastain, Bryan Cranston, Martin Short",United States,"May 1, 2021",2012,PG,96 min,"Children & Family Movies, Comedies","Next stop: New York! But to get back home, Alex and friends must hitch a ride with a traveling European circus and evade an evil animal-control officer."
s962,Movie,The Mitchells vs. The Machines,"Mike Rianda, Jeff Rowe","Danny McBride, Abbi Jacobson, Maya Rudolph, Mike Rianda, Eric André, Olivia Colman, Fred Armisen, Beck Bennett, John Legend, Chrissy Teigen, Blake Griffin, Conan O'Brien, Charlyne Yi",,"April 30, 2021",2021,PG,114 min,"Children & Family Movies, Comedies",A robot apocalypse put the brakes on their cross-country road trip. Now it’s up to the Mitchells — the world’s weirdest family — to save the human race.
s1020,Movie,Lagaan,Ashutosh Gowariker,"Aamir Khan, Gracy Singh, Rachel Shelley, Paul Blackthorne, Kulbhushan Kharbanda, Raghuvir Yadav, Yashpal Sharma, Rajendranath Zutshi, Rajesh Vivek, Aditya Lakhia","India, United Kingdom","April 17, 2021",2001,PG,224 min,"Dramas, International Movies, Music & Musicals","In 1890s India, an arrogant British commander challenges the harshly taxed residents of Champaner to a high-stakes cricket match."
s1023,Movie,Taare Zameen Par,Aamir Khan,"Aamir Khan, Darsheel Safary, Tanay Chheda, Tisca Chopra, Vipin Sharma, Girija Oak, M.K. Raina",India,"April 17, 2021",2007,PG,162 min,"Dramas, International Movies","When daydreamer Ishaan is sent to boarding school, an unconventional art teacher tries to help the imaginative student discover his true identity."
s1102,Movie,Escape from Planet Earth,Cal Brunker,"Rob Corddry, Brendan Fraser, Sarah Jessica Parker, William Shatner, Jessica Alba, Jane Lynch, George Lopez, Sofía Vergara, Craig Robinson, Ricky Gervais, Steve Zahn, Chris Parnell","United States, Canada","April 3, 2021",2013,PG,89 min,"Children & Family Movies, Comedies, Sci-Fi & Fantasy","This all-ages animated comedy follows the adventures of astronaut Scorch Supernova, a hero of the blue aliens who has a vast appetite for adventure."
s1113,Movie,Woody Woodpecker,Alex Zamm,"Timothy Omundson, Thaila Ayala, Eric Bauza, Graham Verchere, Jordana Largy, Scott McNeil, Adrian Glynn McMorran, Chelsea Miller, Sean Tyson",United States,"April 2, 2021",2017,PG,91 min,"Children & Family Movies, Comedies",A rascally bird with a distinctive laugh pecks back with a vengeance when his forest habitat is threatened by a slick lawyer building his dream home.
s1204,Movie,The BFG,Steven Spielberg,"Mark Rylance, Ruby Barnhill, Penelope Wilton, Jemaine Clement, Rebecca Hall, Rafe Spall, Bill Hader, Ólafur Darri Ólafsson, Adam Godley, Michael Adamthwaite, Daniel Bacon, Jonathan Holmes, Chris Gibbs, Paul Moniz de Sa","United States, India, United Kingdom","March 15, 2021",2016,PG,118 min,"Children & Family Movies, Dramas",A little orphan meets up with a kind giant who's supposed to eat her but instead protects her from some truly horrible giants who terrorize them both.
s1219,Movie,YES DAY,Miguel Arteta,"Jennifer Garner, Edgar Ramírez, Jenna Ortega, Julian Lerner, Everly Carganilla, Tracie Thoms, Fortune Feimster, Nat Faxon, Arturo Castro",United States,"March 12, 2021",2021,PG,90 min,"Children & Family Movies, Comedies",A mom and dad who usually say no decide to say yes to their kids' wildest requests — with a few ground rules — on a whirlwind day of fun and adventure.
s1308,Movie,The Resurrection of Gavin Stone,Dallas Jenkins,"Brett Dalton, Anjelah Johnson-Reyes, D.B. Sweeney, Neil Flynn, Shawn Michaels, Patrick Gagnon, Tim Frank, Tara Rios, Liam Matthews, Mary Thornton",United States,"February 16, 2021",2017,PG,92 min,"Children & Family Movies, Comedies, Dramas","After one too many run-ins with the law, a Hollywood bad boy finds redemption while fulfilling his court-ordered community service at a megachurch."
s1331,Movie,The World We Make,Brian Baugh,"Caleb Castille, Rose Reid, Kevin Sizemore, Gregory Alan Williams",United States,"February 10, 2021",2019,PG,108 min,"Dramas, Romantic Movies","A teenage equestrian and a local football player fall for each other, but simmering racism in their small town puts their relationship to the test."
s1365,Movie,Zathura,Jon Favreau,"Jonah Bobo, Josh Hutcherson, Dax Shepard, Kristen Stewart, Tim Robbins, Frank Oz, John Alexander, Derek Mears, Douglas Tait, Joe Bucaro III",United States,"February 1, 2021",2005,PG,101 min,"Children & Family Movies, Sci-Fi & Fantasy","A mysterious game sends two brothers flying into space, where they must reach the planet Zathura — or be trapped in galactic limbo forever."
s1370,Movie,Finding ‘Ohana,Jude Weng,"Kea Peahu, Alex Aiono, Lindsay Watson, Owen Vaccaro, Kelly Hu, Branscombe Richmond, Ke Huy Quan, Brad Kalilimoku, Chris Parnell, Marc Evan Jackson, Ricky Garcia",United States,"January 29, 2021",2021,PG,123 min,"Children & Family Movies, Comedies","In Oʻahu for the summer, two siblings from Brooklyn connect with their Hawaiian heritage — and their family — on a daring quest for long-lost treasure."
s1407,Movie,Penguins of Madagascar: The Movie,"Eric Darnell, Simon J. Smith","Tom McGrath, Christopher Knights, Chris Miller, Conrad Vernon, John Malkovich, Benedict Cumberbatch, Ken Jeong, Annet Mahendru, Peter Stormare",United States,"January 15, 2021",2014,PG,92 min,"Children & Family Movies, Comedies","Elite penguin spies Skipper, Kowalski, Rico and Private join forces with the suave agents of the North Wind to defeat power-mad genius Octavius Brine."
s1435,Movie,Leap!,"Eric Summer, Éric Warin","Bronwen Mantel, Mel Brooks, Maddie Ziegler, Dane DeHaan, Julie Khaner, Elle Fanning, Terrence Scammell, Tamir Kapelian, Carly Rae Jepsen","France, Canada","January 7, 2021",2016,PG,89 min,"Children & Family Movies, Comedies","Félicie and Victor, two young friends in 1880s France, escape from an orphanage to pursue their dreams in Paris, the glittering City of Lights."
s1454,Movie,Good Burger,Brian Robbins,"Kenan Thompson, Kel Mitchell, Abe Vigoda, Dan Schneider, Shar Jackson, Jan Schweiterman, Linda Cardellini, Sinbad, Ron Lester, Josh Server, Ginny Schreiber",United States,"January 1, 2021",1997,PG,96 min,"Children & Family Movies, Comedies","Working at a neighborhood fast-food joint, two teens try to save the restaurant when a giant burger franchise fires up the competition."
s1486,Movie,Rango,Gore Verbinski,"Johnny Depp, Isla Fisher, Abigail Breslin, Ned Beatty, Alfred Molina, Bill Nighy, Stephen Root, Harry Dean Stanton, Timothy Olyphant, Ray Winstone","United States, Canada","December 28, 2020",2011,PG,110 min,"Children & Family Movies, Comedies","When he becomes lost in the desert, pet chameleon Rango pretends he's a tough guy and ends up sheriff of a corrupt and violent frontier town."
s1495,Movie,We Can Be Heroes,Robert Rodriguez,"YaYa Gosselin, Pedro Pascal, Priyanka Chopra, Isaiah Russell-Bailey, Akira Akbar, Christian Slater, Boyd Holbrook, Adriana Barraza, Taylor Dooley, Vivien Lyra Blair, Hala Finley, Lyon Daniels, Sung Kang, Christopher McDonald, Andy Walken, Lotus Blossom, Haley Reinhart, Nathan Blair, Dylan Henry Lau, Andrew Diaz",United States,"December 25, 2020",2020,PG,101 min,"Children & Family Movies, Comedies","When alien invaders capture Earth’s superheroes, their kids must learn to work together to save their parents — and the planet."
s1577,Movie,Bobbleheads The Movie,Kirk Wise,"Jennifer Coolidge, Karen Fukuhara, Khary Payton, Julian Sands, Brenda Song, Luke Wilson, Cher",United States,"December 8, 2020",2020,PG,83 min,"Children & Family Movies, Comedies",A team of bobbleheads band together to defend their collector’s home when uninvited relatives barge in looking to steal from his prized collection.
