show_id,type,title,director,cast,country,date_added,release_year,rating,duration,listed_in,description
s6910,Movie,Hairspray,Adam Shankman,"Nikki Blonsky, John Travolta, Michelle Pfeiffer, Christopher Walken, Amanda Bynes, James Marsden, Queen Latifah, Zac Efron, Brittany Snow, Allison Janney, Elijah Kelley, Jerry Stiller","United States, United Kingdom, Canada","January 1, 2020",2007,PG,116 min,"Children & Family Movies, Comedies, Music & Musicals","In 1962, ambitious plus-size teen Tracy Turnblad tries to integrate a racially divided Baltimore one Watusi at a time."
s6953,Movie,Hedgehogs,Huang Jianming,"Anthony Padilla, Ian Hecox, Jenn McAllister, Jon Heder, Chevy Chase","United States, China","April 1, 2019",2016,PG,94 min,Children & Family Movies,"When a hedgehog suffering from memory loss forgets his identity, he ends up on a big city journey with a pigeon to save his habitat from a human threat."
s6993,Movie,Hoodwinked Too! Hood vs. Evil,Mike Disa,"Hayden Panettiere, Glenn Close, Patrick Warburton, Joan Cusack, David Ogden Stiers, Bill Hader, Amy Poehler, Andy Dick, Martin Short, Brad Garrett, Cheech Marin, Tommy Chong, Heidi Klum, Wayne Newton",United States,"November 3, 2018",2011,PG,86 min,"Children & Family Movies, Comedies","Fresh off a top-secret training, feisty heroine Little Red teams up with intrepid reporter Wolf to investigate the disappearance of Hansel and Gretel."
s6995,Movie,Hope Springs Eternal,Jack C. Newell,"Mia Rose Frampton, Beth Lacke, Stony Blyden, Juliette Angelo, Lauren Giraldo, Beau Brooks, Pej Vahdat",United States,"November 8, 2018",2018,PG,79 min,Dramas,"When a teen with terminal cancer miraculously finds herself in remission, she struggles to give up the attention her illness gave her at school."
s7009,Movie,Hotel Transylvania 3: Summer Vacation,Genndy Tartakovsky,"Adam Sandler, Selena Gomez, Kevin James, Kathryn Hahn, Andy Samberg, David Spade, Steve Buscemi, Fran Drescher, Molly Shannon, Mel Brooks, Keegan-Michael Key",United States,"January 24, 2019",2018,PG,97 min,"Children & Family Movies, Comedies","It's love at first sight for Dracula when he meets Ericka, the charming but mysterious captain of the monster cruise that Mavis plans for the family."
s7014,Movie,How the Grinch Stole Christmas,Ron Howard,"Jim Carrey, Taylor Momsen, Jeffrey Tambor, Christine Baranski, Bill Irwin, Molly Shannon, Clint Howard, Josh Ryan Evans, Mindy Sterling, Anthony Hopkins",United States,"June 1, 2017",2000,PG,105 min,"Children & Family Movies, Comedies",The Grinch decides to rob Whoville of Christmas – but a dash of kindness from little Cindy Lou Who and her family may be enough to melt his heart.
s7037,Movie,I Am Bolt,"Benjamin Turner, Gabe Turner",Usain Bolt,United Kingdom,"October 1, 2017",2016,PG,107 min,"Documentaries, Sports Movies","Mixing archival footage with present-day interviews, Olympic champion and global icon Usain Bolt opens up about his athletic legacy."
s7050,Movie,I'm in Love with a Church Girl,Steve Race,"Ja Rule, Adrienne Bailon, Stephen Baldwin, Vincent Pastore, Michael Madsen, T-Bone, Martin Kove, Toby Mac",United States,"October 1, 2017",2013,PG,119 min,"Dramas, Faith & Spirituality, Romantic Movies","When a tough-minded ex-drug dealer falls for a beautiful but highly devout woman, their mutual attraction takes them both down a twisty path."
s7056,Movie,Igor,Tony Leondis,"John Cusack, Steve Buscemi, Sean Hayes, Molly Shannon, Eddie Izzard, Jennifer Coolidge, Jay Leno","United States, France","September 1, 2019",2008,PG,87 min,Children & Family Movies,"Igor, the brilliant but deformed assistant to mad Dr. Glickenstein, dreams of winning the Evil Science Fair and the heart of village beauty Gretchen."
s7058,Movie,Imagine That,Karey Kirkpatrick,"Eddie Murphy, Thomas Haden Church, Yara Shahidi, Ronny Cox, Stephen Rannazzisi, Nicole Ari Parker, DeRay Davis, Vanessa Williams, Martin Sheen, Lauren Weedman, Timm Sharp, Bobb'e J. Thompson","United States, Germany","December 7, 2019",2009,PG,108 min,"Children & Family Movies, Comedies, Sci-Fi & Fantasy","Work problems are piling up for a businessman. But when he discovers a pathway to his daughter's imaginary world, he starts finding some solutions."
s7068,Movie,Incredibles 2 (Spanish Version),Brad Bird,"Víctor Trujillo, Consuelo Duval, Darío T. Pie, Leyla Rangel, Oliver Díaz Barba, Dulce Guerrero, Eli Fucile, Martin Hernandez",United States,"February 8, 2019",2018,PG,118 min,"Children & Family Movies, Comedies","When Elastigirl gets recruited for a high-profile crime-fighting mission, Mr. Incredible takes on his toughest assignment ever: full-time parenting."
s7073,Movie,Indiana Jones and the Raiders of the Lost Ark,Steven Spielberg,"Harrison Ford, Karen Allen, Paul Freeman, Ronald Lacey, John Rhys-Davies, Denholm Elliott, Alfred Molina, Wolf Kahler, Anthony Higgins, Vic Tablian",United States,"January 1, 2019",1981,PG,116 min,"Action & Adventure, Children & Family Movies, Classic Movies","When Indiana Jones is hired by the government to locate the legendary Ark of the Covenant, he finds himself up against the entire Nazi regime."
s7074,Movie,Indiana Jones and the Temple of Doom,Steven Spielberg,"Harrison Ford, Kate Capshaw, Amrish Puri, Roshan Seth, Philip Stone, Roy Chiao, Jonathan Ke Quan, David Yip, Ric Young, Chua Kah Joo",United States,"January 1, 2019",1984,PG,119 min,"Action & Adventure, Children & Family Movies, Classic Movies","Indiana Jones, his young sidekick and a spoiled songbird get more than they bargained for when they go to India in search of a missing magical stone."
s7076,Movie,Inequality for All,Jacob Kornbluth,Robert Reich,United States,"August 29, 2018",2013,PG,90 min,Documentaries,Former U.S. Labor Secretary Robert Reich makes a compelling case about the serious crisis the U.S. faces due to the widening economic gap.
s7079,Movie,Inkheart,Iain Softley,"Brendan Fraser, Paul Bettany, Helen Mirren, Jim Broadbent, Andy Serkis, Sienna Guillory, Eliza Bennett, Rafi Gavron, Lesley Sharp, Jamie Foreman","Germany, United Kingdom, United States","July 1, 2019",2008,PG,106 min,"Action & Adventure, Children & Family Movies, Sci-Fi & Fantasy","Unbeknownst to his 12-year-old daughter, a bookbinder has a secret ability to bring characters to life by reading their stories out loud."
s7098,Movie,Iron Man & Captain America: Heroes United,Leo Riley,"Adrian Pasdar, Roger Craig Smith, Fred Tatasciore, David Kaye, Clancy Brown, Liam O'Brien, Robin Atkin Downes, Dee Bradley Baker",United States,"October 12, 2014",2014,PG,71 min,"Children & Family Movies, Sci-Fi & Fantasy","While battling to keep the Red Skull and Taskmaster from unleashing a Hydra army, Iron Man and Captain America must learn to work together."
s7104,Movie,It Takes Two,Andy Tennant,"Kirstie Alley, Steve Guttenberg, Mary-Kate Olsen, Ashley Olsen, Philip Bosco, Jane Sibbett",United States,"November 20, 2019",1995,PG,101 min,"Children & Family Movies, Comedies","The Olsen twins put a cute new spin on Mark Twain's classic tale ""The Prince and the Pauper,"" playing identical 9-year-olds from very different backgrounds: orphaned Amanda and wealthy Alyssa."
s7111,Movie,Jack and the Cuckoo-Clock Heart,"Mathias Malzieu, Stéphane Berla","Orlando Seale, Samantha Barks, Harry Sadeghi, Stephane Cornicard, Jessie Buckley, Sophia Ellis, Barbara Scaff, Michelle Fairley, Richard Ridings, Howard Samuels","France, Belgium","February 8, 2017",2013,PG,93 min,"Children & Family Movies, Music & Musicals","Equipped with a mechanical heart and determined to stay out of death's shadow, young Jack understands that love could prove fatal."
s7133,Movie,Jiro Dreams of Sushi,David Gelb,Jiro Ono,United States,"June 5, 2019",2011,PG,79 min,Documentaries,"This documentary profiles sushi chef Jiro Ono, an 85-year-old master whose 10-seat, $300-a-plate restaurant is legendary among Tokyo foodies."
s7146,Movie,Judy Moody and the Not Bummer Summer,John Schultz,"Jordana Beatty, Heather Graham, Parris Mosteller, Preston Bailey, Kristoffer Ryan Winters, Garrett Ryan, Jaleel White, Ashley Boettcher, Taylar Hender, Cameron Boyce, Jenica Bergere, Janet Varney",United States,"August 8, 2019",2011,PG,91 min,"Children & Family Movies, Comedies","In this family film, never-dull third-grader Judy Moody embarks on a summer adventure with her brother, Stink, and always-up-for-fun Aunt Opal."
s7165,Movie,Kahlil Gibran's The Prophet,"Roger Allers, Gaëtan Brizzi, Paul Brizzi, Joan C. Gratz, Mohammed Saeed Harib, Tomm Moore, Nina Paley, Bill Plympton, Joann Sfar, Michael Socha","Liam Neeson, Salma Hayek, John Krasinski, Frank Langella, Alfred Molina, John Rhys-Davies, Quvenzhané Wallis","United States, France, Canada, Lebanon, Qatar","October 1, 2017",2014,PG,85 min,"Children & Family Movies, Dramas",A troubled young girl and her mother find solace on a journey with a subversive poet whose words captivate their hearts and imaginations.
s7275,Movie,Leap Year,Anand Tucker,"Amy Adams, Matthew Goode, Adam Scott, John Lithgow, Noel O'Donovan, Tony Rohr, Pat Laffan, Alan Devlin, Ian McElhinney, Dominique McElligott","United States, Ireland","November 15, 2019",2010,PG,100 min,"Comedies, Romantic Movies","Anna chooses February 29 to propose marriage to her boyfriend, but after meeting a charming innkeeper, she must evaluate her original plans."
s7283,Movie,Legend of the Guardians: The Owls of Ga'Hoole,Zack Snyder,"Helen Mirren, Geoffrey Rush, Jim Sturgess, Hugo Weaving, Emily Barclay, Abbie Cornish, Ryan Kwanten, Anthony LaPaglia, Miriam Margolyes, Sam Neill","United States, Australia","January 1, 2020",2010,PG,97 min,Children & Family Movies,"Soren, a barn owl kidnapped from his peaceful forest home, is brought to an orphanage where he must train to become a soldier."
s7316,Movie,Little Men,Ira Sachs,"Greg Kinnear, Jennifer Ehle, Paulina García, Alfred Molina, Michael Barbieri, Theo Taplitz, Talia Balsam, Maliq Johnson, Anthony A. Flamminio, Madison Wright, John Procaccino","United States, Greece, Brazil","January 12, 2017",2016,PG,85 min,"Dramas, Independent Movies",Jake and Tony become friends when Jake's dad inherits a home above Tony's mother's shop. Friendship is tested when Jake's dad raises the shop's rent.
s7331,Movie,Logan's Run,Michael Anderson,"Michael York, Richard Jordan, Farrah Fawcett, Jenny Agutter, Peter Ustinov, Roscoe Lee Browne, Randolph Roberts, Gary Morgan, Greg Lewis",United States,"November 1, 2019",1976,PG,118 min,"Action & Adventure, Classic Movies, Cult Movies","In the 23rd century, inhabitants of a domed city exist in a world filled with life's pleasures – but no one is allowed to live past the age of 30."
s7416,Movie,Marvel's Iron Man & Hulk: Heroes United,"Leo Riley, Eric Radomski","Adrian Pasdar, Fred Tatasciore, Dee Bradley Baker, Robin Atkin Downes, David Kaye",United States,"February 16, 2014",2013,PG,72 min,"Action & Adventure, Sci-Fi & Fantasy","When scientists join Hulk's gamma energy with Tony Stark's Arc Reactor, the resulting force creates a foe that only the two Marvel heroes can combat."
s7417,Movie,Mary and the Witch's Flower,Hiromasa Yonebayashi,"Ruby Barnhill, Kate Winslet, Jim Broadbent, Ewen Bremner, Lynda Baron, Louis Ashbourne Serkis, Morwenna Banks, Teresa Gallagher, Rasmus Hardiker",Japan,"July 17, 2018",2017,PG,103 min,"Anime Features, Children & Family Movies","Ordinary girl Mary picks an extraordinary flower and travels to Endor College, a school for magic. But its foremost teachers have a sinister plan."
s7418,Movie,Mary Poppins Returns,Rob Marshall,"Emily Blunt, Lin-Manuel Miranda, Ben Whishaw, Emily Mortimer, Pixie Davies, Nathanael Saleh, Joel Dawson, Julie Walters, Meryl Streep, Colin Firth, Dick Van Dyke","United States, United Kingdom","July 9, 2019",2018,PG,131 min,"Children & Family Movies, Music & Musicals","In 1930s London, Michael Banks and his three children get some help turning their topsy-turvy world around when his magical childhood nanny reappears."
s7453,Movie,Middle School: The Worst Years of My Life,Steve Carr,"Griffin Gluck, Lauren Graham, Rob Riggle, Thomas Barbusca, Andrew Daly, Adam Pally, Retta, Efren Ramirez, Isabela Moner, Alexa Nisenson, Jacob Hopkins","United States, Cambodia","March 3, 2019",2016,PG,92 min,"Children & Family Movies, Comedies","At Hills Village Middle School, budding cartoonist Rafe and best pal Leo challenge their uptight principal by breaking every rule in his handbook."
s7461,Movie,Miracle,Gavin O'Connor,"Kurt Russell, Patricia Clarkson, Noah Emmerich, Sean McCann, Kenneth Welsh, Eddie Cahill, Patrick O'Brien Demsey, Michael Mantenuto, Nathan West, Kenneth Mitchell, Sam Skoryna, Billy Schneider, Michael Kopsa, Beverley Breuer, Lisa Marie Caruk, Ryan Walter, Nate Miller, Joseph Cure, Scott Johnson, Eric Peter-Kaiser, Bobby Hanson","Canada, United States","June 1, 2018",2004,PG,136 min,"Children & Family Movies, Dramas, Sports Movies",U.S. hockey coach Herb Brooks unites a motley crew of college athletes and turns them into a force to be reckoned with at the 1980 Winter Olympics.
s7462,Movie,Mirror Mirror,Tarsem Singh,"Julia Roberts, Lily Collins, Armie Hammer, Nathan Lane, Mare Winningham, Michael Lerner, Sean Bean, Robert Emms, Danny Woodburn, Martin Klebba, Sebastian Saraceno, Jordan Prentice, Mark Povinelli, Joe Gnoffo, Ronald Lee Clark","United States, Canada","April 24, 2020",2012,PG,106 min,"Children & Family Movies, Comedies",This remake of the classic Grimm tale follows fair-skinned Snow White on a quest to regain her royal throne with help from a team of shady dwarves.
s7487,Movie,Monkey Up,Robert Vince,"Jonathan Mangum, Erin Allin O'Reilly, Kayden Magnuson, Danny Woodburn, Skylar Astin, John Ratzenberger, David Milchard",Canada,"March 19, 2016",2016,PG,83 min,"Children & Family Movies, Comedies",A talking monkey famous for his TV commercials dreams of breaking into real movies. But first he stumbles upon a brother and sister who need his help.
s7489,Movie,Monster Family,Holger Tappe,"Celia Imrie, Emily Watson, Catherine Tate, Jason Isaacs, Nick Frost, Jessica Brown Findlay","Germany, United Kingdom","April 4, 2018",2017,PG,93 min,Children & Family Movies,A family’s festive Halloween plans take a spooky turn when an evil witch's curse transforms the costumed clan into actual monsters.
s7515,Movie,Mountain,Jennifer Peedom,,Australia,"October 1, 2018",2017,PG,74 min,"Action & Adventure, Documentaries, International Movies","Featuring breathtaking imagery and thought-provoking narration, this film takes viewers to the summits of some of the world’s most amazing mountains."
s7526,Movie,Mune: Guardian of the Moon,"Alexandre Heboyan, Benoît Philippon","Joshua J. Ballard, Nicole Provost, Trevor Devall, Michael Dobson, Jonathan Love, Davey Grant",France,"January 26, 2018",2014,PG,85 min,Children & Family Movies,"When the old guardian of the moon retires, the mischievous Mune is chosen as his successor, but he worries he's not up to the job."
s7527,Movie,Muppets Most Wanted,James Bobin,"Ricky Gervais, Ty Burrell, Tina Fey, Kermit the Frog, Miss Piggy, Fozzie Bear, Gonzo, Muppets, Steve Whitmire, Eric Jacobson, Dave Goelz, Bill Barretta, David Rudman, Matt Vogel, Peter Linz",United States,"September 1, 2020",2014,PG,110 min,"Children & Family Movies, Comedies","In the middle of their global tour, the Muppets inadvertently get mixed up in a perilous drama involving a gang of international jewel thieves."
s7554,Movie,Nacho Libre,Jared Hess,"Jack Black, Ana de la Reguera, Héctor Jiménez, Darius Rose, Moises Arias, Diego Eduardo Gomez, Carlos Maycotte, Richard Montoya, Cesar Gonzalez, Rafael Montalvo","United States, Mexico","November 1, 2019",2006,PG,92 min,"Comedies, Sports Movies","When Ignacio learns of an orphanage's financial woes, he pitches in to help – by disguising himself and joining the professional wrestling circuit."
s7565,Movie,National Treasure,Jon Turteltaub,"Nicolas Cage, Diane Kruger, Justin Bartha, Sean Bean, Jon Voight, Harvey Keitel, Christopher Plummer",United States,"June 1, 2018",2004,PG,131 min,"Action & Adventure, Children & Family Movies","Modern treasure hunters search for a chest of riches rumored to have been stashed away by George Washington, Thomas Jefferson and Benjamin Franklin."
s7580,Movie,New York Minute,Dennie Gordon,"Mary-Kate Olsen, Ashley Olsen, Eugene Levy, Andy Richter, Riley Smith, Jared Padalecki, Drew Pinsky, Darrell Hammond, Andrea Martin, Alannah Ong, Mary Bond Davis, Bob Saget, Jack Osbourne",United States,"January 1, 2020",2004,PG,91 min,"Children & Family Movies, Comedies","When bickering teenage twins accidentally land in the middle of a criminal operation, they'll have to work together to get themselves out of trouble."
s7593,Movie,No Reservations,Scott Hicks,"Catherine Zeta-Jones, Aaron Eckhart, Abigail Breslin, Patricia Clarkson, Jenny Wade, Bob Balaban, Brían F. O'Byrne, Lily Rabe",United States,"October 1, 2019",2007,PG,104 min,"Comedies, Romantic Movies","Kate, an uptight chef, finds her life turned upside down when her sister dies in a car accident and she becomes her niece's sole guardian."
s7662,Movie,One Direction: This Is Us,Morgan Spurlock,"Harry Styles, Niall Horan, Zayn Malik, Louis Tomlinson, Liam Payne",United States,"October 1, 2019",2013,PG,92 min,"Documentaries, Music & Musicals",Award-winning documentarian Morgan Spurlock turns his camera on boy band phenomenon One Direction in this combination concert film and backstage pass.
s7670,Movie,Open Season,"Roger Allers, Jill Culton","Martin Lawrence, Ashton Kutcher, Gary Sinise, Debra Messing, Billy Connolly, Georgia Engel, Jon Favreau, Jane Krakowski, Gordon Tootoosis, Patrick Warburton",United States,"September 1, 2019",2006,PG,86 min,"Children & Family Movies, Comedies","After saving a deer from a hunter's clutches, a domesticated grizzly finds himself relocated to the wild – and unprepared for the real world."
s7717,Movie,Paul Blart: Mall Cop,Steve Carr,"Kevin James, Keir O'Donnell, Jayma Mays, Raini Rodriguez, Shirley Knight, Stephen Rannazzisi, Peter Gerety, Bobby Cannavale, Adam Ferrara, Jamal Mixon, Adhir Kalyan, Gary Valentine",United States,"November 1, 2020",2009,PG,91 min,"Action & Adventure, Comedies",An overzealous security guard finds himself in over his head when he tries to thwart a criminal mastermind's plot to rob an entire shopping mall.
s7725,Movie,Penelope,Mark Palansky,"Christina Ricci, James McAvoy, Catherine O'Hara, Peter Dinklage, Simon Woods","United Kingdom, United States","April 1, 2019",2006,PG,89 min,"Children & Family Movies, Comedies, Romantic Movies","In this modern fairy tale, a young woman cursed with the nose of a pig lives her life in seclusion – until an unlikely beau stumbles onto the scene."
s7733,Movie,Peter Rabbit,Will Gluck,"James Corden, Domhnall Gleeson, Rose Byrne, Margot Robbie, Daisy Ridley, Elizabeth Debicki, Vauxhall Jermaine, Marianne Jean-Baptiste, Sia, Colin Moody","United States, Australia","August 18, 2018",2018,PG,95 min,"Children & Family Movies, Comedies","In this mix of live action and CGI, rascally Peter Rabbit faces a tough new foe in his ongoing battle for the veggies in Mr. McGregor's garden."
s7735,Movie,Phantom Boy,"Jean-Loup Felicioli, Alain Gagnol","Marcus D'Angelo, Vincent D'Onofrio, Fred Armisen, Jared Padalecki, Joey Camen, Brian T. Delaney, Melissa Disney, Bill Lobley, Amanda Céline Miller, Dana Snyder, Stephanie Sheh","France, Belgium","October 1, 2017",2015,PG,85 min,"Action & Adventure, Dramas, International Movies",A boy whose illness allows him to float outside his body uses his newfound skill to help a cop take on a madman who's terrorizing New York City.
s7755,Movie,Pope Francis: A Man of His Word,Wim Wenders,Pope Francis,"Switzerland, Vatican City, Italy, Germany, France","January 3, 2019",2018,PG,96 min,"Documentaries, Faith & Spirituality, International Movies","Documentary filmmaker Wim Wenders travels the world with Pope Francis, recording the controversial pontiff's humanist views in a sharply divided age."
s7756,Movie,Popeye,Robert Altman,"Robin Williams, Shelley Duvall, Ray Walston, Paul Dooley, Paul L. Smith, Richard Libertini, Donald Moffat, Macintyre Dixon, Roberta Maxwell, Donovan Scott",United States,"November 24, 2019",1980,PG,114 min,"Action & Adventure, Children & Family Movies, Comedies","During a storm that wrecks his ship, super-strong sailor Popeye washes ashore and winds up rooming at the Oyl household, where he meets Olive."
s7815,Movie,R.L. Stine's Mostly Ghostly,Richard Correll,"Madison Pettis, Sterling Beaumon, Luke Benward, Brian Stepanek, David DeLuise, Kim Rhodes, Adam Hicks, Ali Lohan, Sabrina Bryan, Rachel Winfree, Diego Acuña",United States,"August 1, 2018",2008,PG,98 min,"Children & Family Movies, Comedies","After discovering a pair of young ghosts, a nebbish 11-year-old agrees to help the sibling spirits solve the mystery surrounding their demise."
s7817,Movie,Race to Witch Mountain,Andy Fickman,"Dwayne Johnson, AnnaSophia Robb, Alexander Ludwig, Carla Gugino, Ciarán Hinds, Tom Everett Scott, Chris Marquette, Billy Brown, Christine Lakin, Tom Woodruff Jr., John Kassir, Garry Marshall, John Duff, Ted Hartley, Dave Engfer, Bob Clendenin, Shengyi Huang, Robert Torti, Kim Richards, Brandon Miller, Paul Darnell, Omar Dorsey, Dennis Hayden, Suzanne Krull, Steve Rosenbaum, Andrew Shaifer, Bryan Fogel, Bob Koherr, Sam Wolfson, Beth Kennedy, Corri English, Jonathan Slavin, Kevin Christy, Meredith Salenger",United States,"July 1, 2019",2009,PG,99 min,Children & Family Movies,A sister and brother with special powers are on the run from a mysterious organization that wants to take advantage of the siblings' gifts.
s7827,Movie,Ralph Breaks the Internet: Wreck-It Ralph 2,"Phil Johnston, Rich Moore","John C. Reilly, Sarah Silverman, Taraji P. Henson, Gal Gadot, Jack McBrayer, Jane Lynch, Alan Tudyk, Ed O'Neill, Susan Lucci, Jason Lee, Idina Menzel, Anika Noni Rose, Judy Reyes, Grant Show, Ana Ortiz, Ming-Na Wen, Rebecca Wisocky, Paige O'Hara, Linda Larkin, Mariana Klaveno, Daria Ramirez, Tom Irwin, Edy Ganem, Irene Bedard, Jodi Benson, Anthony Daniels",United States,"June 11, 2019",2018,PG,113 min,"Children & Family Movies, Comedies","When video-game bad guy Ralph and best friend Vanellope discover a way onto the internet, they set off on a mission to save her broken game."
s7880,Movie,Rocky,John G. Avildsen,"Sylvester Stallone, Talia Shire, Burt Young, Carl Weathers, Burgess Meredith, Thayer David, Joe Spinell, Jimmy Gambina, Bill Baldwin",United States,"August 1, 2019",1976,PG,120 min,"Action & Adventure, Classic Movies, Dramas","Sylvester Stallone shot to fame as Rocky Balboa, an unknown fighter who's given a shot at fighting world champ Apollo Creed as a publicity stunt."
s7881,Movie,Rocky II,Sylvester Stallone,"Sylvester Stallone, Talia Shire, Burt Young, Carl Weathers, Burgess Meredith, Tony Burton, Joe Spinell, Leonard Gaines, John Pleshette, Sylvia Meals",United States,"August 1, 2019",1979,PG,119 min,"Dramas, Sports Movies","Featuring a rousing climax, this engaging sequel finds boxer Rocky Balboa returning to the ring for a rematch against reigning champ Apollo Creed."
s7882,Movie,Rocky III,Sylvester Stallone,"Sylvester Stallone, Talia Shire, Burt Young, Carl Weathers, Burgess Meredith, Tony Burton, Mr. T, Hulk Hogan, Ian Fried",United States,"August 1, 2019",1982,PG,100 min,"Dramas, Sports Movies","After taking a pounding from a powerful young fighter, humbled world champ Rocky Balboa turns to ex-rival Apollo Creed for help in regaining his form."
s7883,Movie,Rocky IV,Sylvester Stallone,"Sylvester Stallone, Talia Shire, Burt Young, Carl Weathers, Dolph Lundgren, Brigitte Nielsen, Tony Burton, Michael Pataki",United States,"August 1, 2019",1985,PG,92 min,"Dramas, Sports Movies","Rocky Balboa takes on the Cold War, coming out of retirement to battle a Soviet fighter who pulverized Rocky's friend and former rival, Apollo Creed."
s7904,Movie,Runaway Bride,Garry Marshall,"Julia Roberts, Richard Gere, Joan Cusack, Hector Elizondo, Rita Wilson, Paul Dooley, Christopher Meloni, Donal Logue, Reg Rogers, Yul Vazquez, Jane Morris, Lisa Roberts, Kathleen Marshall, Jean Schertler, Tom Hines",United States,"December 1, 2020",1999,PG,116 min,"Comedies, Romantic Movies","Sparks fly when a newspaper columnist writes a one-sided, sexist story about a commitment-phobic bride who abandoned three men at the altar."
s7908,Movie,Russell Madness,Robert Vince,"David Milchard, John Ratzenberger, Will Sasso, Mason Vale Cotton, John Hennigan, Sean Giambrone, Charles Robinson, Mckenna Grace, Kate Reinders, Fred Willard",United States,"May 10, 2015",2015,PG,93 min,"Children & Family Movies, Comedies, Sports Movies","A spunky terrier named Russell with serious wrestling chops becomes a sports phenomenon with the help of his coach, a monkey named Hunk."
s7953,Movie,Scales: Mermaids Are Real,Kevan Peterson,"Emmy Perry, Morgan Fairchild, Elisabeth Röhm, Nikki Hahn, Jack Dylan Grazer, Stephen Snedden, Noree Victoria, Sterling Sulieman",United States,"January 23, 2020",2017,PG,93 min,Children & Family Movies,A seemingly ordinary girl learns she will turn into a mermaid on her 12th birthday and be forced to leave her life on land behind.
s7965,Movie,Searching for Bobby Fischer,Steven Zaillian,"Max Pomeranc, Joe Mantegna, Joan Allen, Ben Kingsley, Laurence Fishburne, William H. Macy, Laura Linney, David Paymer, Michael Nirenberg, Robert Stephens",United States,"December 7, 2020",1993,PG,110 min,"Children & Family Movies, Classic Movies, Dramas","When a father learns that his 7-year-old son is a whiz at speed chess, he hires an implacable chess master to coach the boy for competitions."
